competitor,source_type,source_title,source_url,signal_type,signal_summary,why_users_care,recency_note,severity,oleriq_implication
firecrawl,reddit_thread,"firecrawl or custom web scraping?",https://www.reddit.com/r/scrapingtheweb/comments/1qh8oap/firecrawl_or_custom_web_scraping/,complaint,"User says Firecrawl works on harder sites but feels too expensive for recurring product-price scraping compared with building something simpler.","Recurring extraction turns pricing shape into a product decision, not a billing footnote.","Published January 19, 2026.",medium,"Oleriq should make repeat-job economics legible and avoid flat black-box pricing signals."
firecrawl,reddit_thread,"Any pay-as-you-go scrapers that don't expire credits monthly? (Firecrawl alt)",https://www.reddit.com/r/n8n/comments/1q4eccq/any_payasyougo_scrapers_that_dont_expire_credits/,complaint,"User says Firecrawl is solid for research agents in n8n but monthly credits that vanish during idle months create anxiety for bursty workloads.","Bursty users dislike paying a retainer just to keep an API available between runs.","Published January 5, 2026.",medium,"Oleriq should consider burst-friendly pricing or usage framing for intermittent research workflows."
firecrawl,product_hunt_review,"Firecrawl | The Web Data API for AI Agents and Developers",https://www.producthunt.com/products/extract-by-firecrawl?page=1,praise,"Reviewers say Firecrawl reliably turns messy web pages into useful structured data and saves hours that would otherwise go into manual research or brittle scraping.","Users reward tools that produce immediate time savings on real workflows.","Review page visible on May 16, 2026; referenced reviews posted 5-10 months earlier.",medium,"Oleriq should preserve a very fast first win and connect it directly to measurable time saved."
firecrawl,product_hunt_review,"Firecrawl | The Web Data API for AI Agents and Developers",https://www.producthunt.com/products/extract-by-firecrawl?page=1,feature_request,"A Product Hunt reviewer asks for deeper multi-step search that can follow related sources and enrich incomplete entities automatically.","Users move quickly from single-page extraction to research-style enrichment once the base scrape works.","Review page visible on May 16, 2026; most informative request shown as 5 months old.",high,"Oleriq can differentiate with traceable multi-source enrichment instead of one-page-only output."
jina-reader,hn_comment,"Jina.ai offer a really neat (currently free) API for this",https://news.ycombinator.com/item?id=41429728,praise,"Hacker News users praise Jina Reader as a no-auth one-liner that quickly returns Markdown suitable for LLM use.","Immediate usefulness lowers onboarding friction and makes experimentation cheap.","Comment posted September 2, 2024.",medium,"Oleriq should keep single-URL first success extremely fast and obvious."
jina-reader,hn_comment,"If you need this sort of thing in any other language, there's a free, no-auth, no-api-key-required API",https://news.ycombinator.com/item?id=42094064,complaint,"A Hacker News user says Jina Reader does most jobs well but still fails on some Cloudflare-protected sites.","Users accept partial coverage only if the boundary is obvious before production dependence.","Comment posted November 9, 2024.",medium,"Oleriq should communicate coverage boundaries honestly and expose fallback options for protected pages."
jina-reader,reddit_thread,"What is best format for data source for a RAG vector database? JSON, XML, CSV, or Other?",https://www.reddit.com/r/LanguageTechnology/comments/1bim5f8,complaint,"A Reddit commenter says Jina-style cleaned pages can duplicate the first 80-100 lines across URLs and sometimes miss information they wanted.","Cleaned text that duplicates or omits facts weakens trust and retrieval quality.","Comment posted August 1, 2024.",medium,"Oleriq should surface duplication or omission risk and make source-to-output provenance easy to inspect."
jina-reader,reddit_thread,"rebuild data tables from jina.ai - Use r.jina.ai to read a URL",https://www.reddit.com/r/webscraping/comments/1itt89q,complaint,"A user says the raw text came back, but turning it into structured tables was still hard.","Users do not only want readable text; they also want predictable structure for downstream use.","Published February 20, 2025.",medium,"Oleriq should keep structure-preserving extraction explicit rather than assuming markdown alone is enough."
jina-reader,source_gap,"Public review gap for Jina Reader",https://github.com/jina-ai/reader,source_gap,"Public conversation is dense in tips and recommendations, but thin in detailed independent review pages or Product Hunt style feedback for Reader itself.","Sparse review depth makes it harder to see switching reasons and long-run sentiment in public.","Observed May 16, 2026.",low,"Oleriq should not overfit to Jina's public praise without stronger evidence about production satisfaction."
crawl4ai,reddit_thread,"Firecrawl vs Crawl4ai, I tried both and here's what i found",https://www.reddit.com/r/AgentsOfAI/comments/1t3pe4e/firecrawl_vs_crawl4ai_i_tried_both_and_heres_what/,complaint,"User says Crawl4AI took about an hour to set up, Docker was fiddly, JS-heavy sites were hit or miss, and the self-hosted setup became a debugging burden.","Operational drag changes a free tool into an expensive one once maintenance time is counted.","Published May 4, 2026.",high,"Oleriq should minimize environment friction and make browser-backed behavior more dependable on hard pages."
crawl4ai,reddit_thread,"Web Crawlers and AI",https://www.reddit.com/r/AI_Agents/comments/1rka70u/web_crawlers_and_ai/,complaint,"A commenter says Crawl4AI is good for downloading content but its configuration is a bit challenging.","Users value capability, but confusing setup slows adoption and supportability.","Published March 2, 2026.",medium,"Oleriq should keep advanced power available without making configuration feel like a hurdle."
crawl4ai,hn_thread,"Show HN: Crawl4AI – Open-Source Web Crawler for LLMs and Structured Data",https://news.ycombinator.com/item?id=46646798,complaint,"The HN pitch for an unofficial Crawl4AI guide says new developers struggle with production configurations, MCP setup, and n8n bridging.","When a tool spawns unofficial setup hubs, that is a public signal that the official path still feels confusing.","HN thread visible 55 days before May 16, 2026.",medium,"Oleriq should ship opinionated docs for production, MCP, and automation-tool paths before users need community patchwork."
browser-use,reddit_thread,"Why does browser use suck?",https://www.reddit.com/r/AI_Agents/comments/1o67dj5/why_does_browser_use_suck/,complaint,"Commenters say browser-use breaks because UIs change constantly, auth flows break, anti-bot gets in the way, and context or state verification issues pile up.","Agent browser automation is judged on whether it survives messy reality, not just demos.","Published October 15, 2025.",high,"Oleriq should design around bounded failure and state verification instead of optimistic happy-path claims."
browser-use,reddit_thread,"browser-use sucks !!",https://www.reddit.com/r/AI_Agents/comments/1hzt9tt,complaint,"Users report infinite loops, about:blank stalls, long runtimes on basic tasks, and unclear result reporting; one commenter says they built wrapper tooling to make it usable.","If users need wrappers for basic control and clarity, trust collapses quickly.","Thread published about 1.3 years before the accessible crawl snapshot.",high,"Oleriq should keep operator feedback and result reporting clear enough that basic use does not require wrapper tooling."
browser-use,hn_thread,"Launch HN: Browser Use (YC W25) – open-source web agents",https://news.ycombinator.com/item?id=43173378,complaint,"HN commenters say one site blocked them as a bot within seconds and another says the Reddit quickstart example could not complete its task.","Public failure on first trials damages confidence in real-site coverage.","Thread posted February 25, 2025.",high,"Oleriq should be explicit about anti-bot posture and should not imply first-run success on hostile sites without evidence."
browser-use,product_hunt_review,"Browser Use: Make websites accessible for agents",https://www.producthunt.com/products/browser-use,praise,"Reviewers praise Browser Use for reducing Selenium or LangChain glue work, exposing chain-of-thought style journey tracking, and giving a GIF of the run afterward.","Users value not just automation, but post-run evidence that helps them understand what happened.","Review page visible May 16, 2026; highlighted reviews were 8-12 months old.",medium,"Oleriq should treat replay and extraction evidence as a core experience, not optional polish."
browser-use,product_hunt_review,"Browser Use: Make websites accessible for agents",https://www.producthunt.com/products/browser-use,praise,"A reviewer says Browser Use was easy to integrate for login-required browsing through the user's real browser.","Authenticated workflows are high-value, so easy session reuse is a major adoption lever.","Review page visible May 16, 2026; highlighted review was 12 months old.",medium,"Oleriq should make authenticated-session reuse or import simple if it targets serious research workflows."
scrapegraphai,product_hunt_review,"ScrapeGraphAI: Turn websites into APIs",https://www.producthunt.com/products/scrapegraphai,praise,"The Product Hunt page shows a positive review footprint and frames ScrapeGraphAI as fast enough for structured extraction use cases like lead enrichment and KYB automation.","Speed-to-usable-JSON is a key buying signal for teams that care more about output than crawling internals.","Product Hunt page visible May 16, 2026; review footprint is small.",medium,"Oleriq should tie output usefulness to concrete tasks, not only generic scraping claims."
scrapegraphai,product_hunt_comment,"ScrapeGraphAI launch discussion",https://www.producthunt.com/products/scrapegraphai,feature_request,"Public launch questions focus on whether the tool can handle multiple pages, JavaScript-driven pagination, and schema control instead of only one-page prompt extraction.","Users quickly push past the demo and ask whether the tool survives realistic site behavior and controlled outputs.","Launch page visible May 16, 2026.",high,"Oleriq should make pagination behavior and output-schema control explicit in-product and in docs."
scrapegraphai,source_gap,"Independent review gap for ScrapeGraphAI",https://www.producthunt.com/products/scrapegraphai,source_gap,"Outside GitHub and Product Hunt, independent public review coverage for ScrapeGraphAI was sparse in this pass.","Sparse independent discussion makes it harder to separate launch energy from durable user sentiment.","Observed May 16, 2026.",medium,"Oleriq should treat ScrapeGraphAI as a useful comparator on positioning, but not as a richly validated public-sentiment benchmark yet."
webclaw,reddit_thread,"webclaw hit almost 400 GitHub stars in 8 days here's what it does and what's next",https://www.reddit.com/r/ClaudeAI/comments/1s9syoj/webclaw_hit_almost_400_github_stars_in_8_days/,complaint,"A technical commenter says trust and product clarity are weak points: the local-versus-cloud boundary feels unclear, messaging feels overstated, and independent tests still found edge-case extraction failures.","Users hesitate when a tool's success envelope and deployment boundary are not explicit.","Published April 1, 2026.",high,"Oleriq should be extremely concrete about local limits, cloud escalation, and where extraction reliability degrades."
webclaw,reddit_thread,"webclaw hit almost 400 GitHub stars in 8 days here's what it does and what's next",https://www.reddit.com/r/ClaudeAI/comments/1s9syoj/webclaw_hit_almost_400_github_stars_in_8_days/,complaint,"Another commenter says Webclaw worked perfectly locally but failed against a Vercel security checkpoint when moved to a cloud server.","A tool that works locally but not in cloud deployment creates a painful trust break for production use.","Published April 1, 2026.",high,"Oleriq should distinguish local success from deployed success and expose site-defense evidence when behavior changes across environments."
webclaw,source_gap,"Independent review gap for Webclaw",https://github.com/0xMassi/webclaw,source_gap,"Public discussion exists, but much of it is founder-authored or founder-adjacent rather than broad third-party review coverage.","Sparse independent validation makes public sentiment noisier and more marketing-shaped.","Observed May 16, 2026.",medium,"Oleriq should use Webclaw as a signal for emerging expectations, but should discount hype-heavy surfaces."
crw,reddit_thread,"Best way to do web scraping / search automation in OpenClaw? (startup use case)",https://www.reddit.com/r/openclaw/comments/1s8ztah/best_way_to_do_web_scraping_search_automation_in/,praise,"A commenter recommends fastCRW as the fastest and lightest open-source scraper when others describe noisy or unreliable search-plus-scrape stacks.","Lightweight deployment and clean output are meaningful switching reasons for early agent builders.","Thread published April 18, 2026; recommendation comment was 23 days before prior capture.",medium,"Oleriq should keep the starter path lightweight enough that users do not feel pushed into heavy infrastructure."
crw,reddit_thread,"Web search tool for openclaw",https://www.reddit.com/r/openclaw/comments/1rx9jr9/web_search_tool_for_openclaw/,praise,"A commenter recommends fastCRW because of its tiny binary and low-friction cloud search support for cost-sensitive experimentation.","Users in early agent workflows care about setup weight almost as much as extraction quality.","Thread published around March 2026; recommendation comment was about one month before prior capture.",medium,"Oleriq should reduce install and run friction for users exploring extraction inside agent workflows."
crw,public_blog,"I couldn't stand waiting 4.6s per page on Firecrawl, so I wrote my own web scraper in Rust",https://dev.to/us/i-couldnt-stand-waiting-46s-per-page-on-firecrawl-so-i-wrote-my-own-web-scraper-in-rust-2h46,complaint,"The public writeup says CRW is still evolving and calls out missing WebSocket streaming, missing screenshot or PDF capture, and docs that are still growing.","Early adopters can tolerate speed-first tradeoffs, but production teams notice maturity gaps quickly.","DEV post visible May 16, 2026.",medium,"Oleriq can differentiate by pairing low-friction operation with a more mature evidence and feature surface."
crw,source_gap,"Independent review gap for CRW",https://github.com/us/crw,source_gap,"Independent public review coverage for CRW was the thinnest in this pass; visible signals were mostly community recommendations and launch-style writing.","Thin public review depth limits confidence about churn reasons, onboarding pain, and long-run reliability sentiment.","Observed May 16, 2026.",high,"Oleriq should explicitly mark CRW as a sparse-evidence comparator when weighing its public traction."
