scope,competitor,source_type,signal_type,theme,summary,user_impact,source_url
firecrawl_vs_crawl4ai_vs_jina_reader,firecrawl_vs_crawl4ai,buyer_evaluation_article,switch_driver,managed_convenience_vs_control,"Apify's comparison frames Firecrawl as the managed path and Crawl4AI as the control-heavy path where the user owns browsers, retries, scaling, and proxy decisions.","Teams switch toward managed options when scraping is support work instead of core infrastructure.","https://blog.apify.com/crawl4ai-vs-firecrawl/"
firecrawl_vs_crawl4ai_vs_jina_reader,firecrawl_vs_crawl4ai_vs_jina_reader,buyer_evaluation_article,switch_driver,workload_fit,"ToolHalla groups the market by workload: Jina Reader for one-page reads, Firecrawl for convenient site crawling, and Crawl4AI for custom large-crawl control.","Buyers compare by workload class rather than by a generic feature matrix.","https://toolhalla.ai/blog/firecrawl-vs-crawl4ai-vs-jina-reader-2026"
firecrawl_vs_crawl4ai_vs_jina_reader,jina_reader,buyer_evaluation_article,underdelivered,auth_and_browser_limits,"The same ToolHalla comparison says Jina Reader has no cookie, auth, or custom JavaScript hooks and is not the right fit for login, CAPTCHA, or multi-step browser work.","Users outgrow zero-config simplicity once pages require state or interaction.","https://toolhalla.ai/blog/firecrawl-vs-crawl4ai-vs-jina-reader-2026"
firecrawl_vs_crawl4ai_vs_jina_reader,crawl4ai,reddit_comparison,distrust,self_host_stability,"A Reddit comparison says Crawl4AI's Docker setup degraded over time and started dropping requests randomly after about three weeks.","Long-run instability makes self-hosted control harder to trust.","https://www.reddit.com/r/AgentsOfAI/comments/1t3pe4e/firecrawl_vs_crawl4ai_i_tried_both_and_heres_what/"
firecrawl_vs_crawl4ai_vs_jina_reader,firecrawl,reddit_comparison,distrust,pricing_predictability,"The same Reddit thread says Firecrawl's non-rollover credits are a real annoyance even for users who otherwise prefer its reliability, and commenters recommend mapping first to limit spend.","Pricing friction can slow adoption even when product output is strong.","https://www.reddit.com/r/AgentsOfAI/comments/1t3pe4e/firecrawl_vs_crawl4ai_i_tried_both_and_heres_what/"
firecrawl_vs_crawl4ai_vs_jina_reader,firecrawl,issue_thread,distrust,anti_bot_fingerprint_gap,"A Firecrawl issue reports that self-hosted Firecrawl failed on a protected target while Browserless succeeded from the same IP, pointing to browser-fingerprint weakness rather than simple IP reputation.","Buyers distrust broad anti-bot claims when protected pages fail outside the hosted path.","https://github.com/firecrawl/firecrawl/issues/2257"
firecrawl_vs_crawl4ai_vs_jina_reader,crawl4ai,issue_thread,distrust,setup_friction,"A Crawl4AI issue shows the documented Docker Compose path failing with an invalid compose project error.","Setup friction pushes evaluators back toward managed APIs even when they prefer open source.","https://github.com/unclecode/crawl4ai/issues/554"
firecrawl_vs_webclaw_crw,webclaw,reddit_comparison,switch_driver,anti_bot_cost_switching,"A public Webclaw competitor thread says Firecrawl uses headless Chrome and proxy rotation for protected sites while Webclaw tries TLS fingerprinting first, and it pitches a Firecrawl-compatible base-URL swap as the migration path.","Lower-latency protected-page handling and easier migration are explicit switching hooks.","https://www.reddit.com/r/micro_saas/comments/1sf1h7x/two_weeks_in_building_an_open_source_firecrawl/"
firecrawl_vs_webclaw_crw,crw,reddit_comparison,switch_driver,lightweight_local_control,"In the same competitor thread, a CRW comment pitches a 6MB lightweight crawler that uses a lower-memory JavaScript renderer instead of full Chrome for every case.","Budget-sensitive buyers are looking for cheaper local control, not only prettier extraction.","https://www.reddit.com/r/SaaS/comments/1seudr8/im_building_an_open_source_firecrawl_competitor/"
browser_agents_browser_use_vs_playwright_mcp,playwright_mcp,reddit_comparison,underdelivered,tool_sprawl,"A Reddit comparison says Playwright MCP took 23 tool calls just to log in and still struggled to manipulate the form, which pushed the user back toward direct Playwright-backed scripts.","If the agent path needs too many steps, users switch to scripts they can predict and debug.","https://www.reddit.com/r/mcp/comments/1sx45zv/browser_mcp_or_playwright_mcp/"
browser_agents_browser_use_vs_playwright_mcp,playwright_mcp,issue_thread,distrust,session_persistence,"A Playwright MCP issue says chat clients close the browser after each tool call, leaving no open page for the next action.","Multi-step browser workflows break when session state disappears between calls.","https://github.com/microsoft/playwright-mcp/issues/1045"
browser_agents_browser_use_vs_playwright_mcp,browser_use,hacker_news_comparison,distrust,security_trust,"Launch HN criticism of Browser Use says guiding users to run their main Chrome profile with remote debugging creates a serious security risk because CDP was not designed as a production trust boundary.","Teams hesitate to use real-browser agent setups when the session model can expose cookies, storage, and live accounts.","https://news.ycombinator.com/item?id=43173378"
