scope,subject,source_type,source_title,source_url,signal_type,signal_summary,why_users_care,recency_note,severity,clearpage_implication
direct_competitor,firecrawl,github_issue,[Self-Host] Waterfalling into a permanent loop when blocked by anti-bot,https://github.com/firecrawl/firecrawl/issues/2350,complaint,Self-hosted Firecrawl can become unresponsive in an anti-bot fallback loop instead of timing out cleanly.,"Users need extraction jobs to fail predictably under hostile pages, not hang indefinitely.","GitHub issue opened November 1, 2025.",high,Clearpage should expose timeout and fallback state clearly and avoid silent retry loops in batch or self-hosted flows.
direct_competitor,firecrawl,github_issue,[Bug] No Data is Returned After Crawling (formats-JSON),https://github.com/firecrawl/firecrawl/issues/1309,complaint,A crawl can report completed and successful while returning an empty data array.,False-success states break trust and make automation pipelines hard to debug.,"GitHub issue opened March 7, 2025.",high,Clearpage should separate job completion from data-success and surface zero-result causes explicitly.
direct_competitor,firecrawl,github_issue,[Self-Host] /extract endpoint failing with ollama / llama3.2:1b,https://github.com/firecrawl/firecrawl/issues/1294,complaint,Self-hosted extract flows can fail when local-model schema output does not match expected object structure.,Self-host users want local control without fragile extraction behavior.,"GitHub issue opened March 5, 2025.",high,Clearpage should keep extraction contracts strict but provide clearer validation errors and safer degraded modes.
direct_competitor,firecrawl,github_issue,[Feat] Remove cookie banner/pop up from screenshots,https://github.com/firecrawl/firecrawl/issues/647,feature_request,Users want screenshot output without cookie banners or privacy popups covering key content.,Obstructed screenshots reduce validation value and hurt downstream visual extraction use cases.,"GitHub issue opened September 9, 2024.",medium,Clearpage can differentiate by offering cleaner screenshot or preview output when visual confirmation matters.
direct_competitor,firecrawl,reddit_post,firecrawl or custom web scraping?,https://www.reddit.com/r/scrapingtheweb/comments/1qh8oap/firecrawl_or_custom_web_scraping/,complaint,A user said Firecrawl handled harder sites but became too expensive for recurring product-price scraping.,Recurring extraction economics matter for users with many URLs or repeat schedules.,"Reddit post published January 19, 2026.",medium,Clearpage should make cost shape legible for repeat jobs and avoid looking like a flat-cost black box.
direct_competitor,jina-reader,github_issue,Extremely high token usage on s.jina.ai — spikes up to 1.9M tokens per single request,https://github.com/jina-ai/reader/issues/1241,complaint,Users are reporting unexpectedly large token consumption on Jina Reader requests.,Token spikes create cost risk and make the tool harder to trust inside production agent loops.,"GitHub issue opened April 9, 2026.",high,Clearpage should show output-size and token-risk signals before or after extraction when relevant.
direct_competitor,jina-reader,github_issue,Improve documentation / provide llms.txt file,https://github.com/jina-ai/reader/issues/1224,feature_request,Users want better documentation packaging and an llms.txt entry point for agent discovery.,Agent users value fast navigation to the right docs and machine-readable product guidance.,"GitHub issue opened November 18, 2025.",medium,"Clearpage should treat agent-readable docs and discoverability as product surfaces, not documentation extras."
direct_competitor,jina-reader,github_issue,Reader can't read certain pdf links,https://github.com/jina-ai/reader/issues/1170,complaint,Some PDF links fail to parse correctly in Reader.,Document ingestion reliability matters for RAG and conversion workflows.,"GitHub issue opened March 21, 2025.",high,Clearpage can compete by being more explicit and reliable on document-path coverage.
direct_competitor,jina-reader,github_issue,Unable to crawl heavy Javascript based website,https://github.com/jina-ai/reader/issues/1148,complaint,Users report coverage gaps on JS-heavy pages.,"If dynamic pages fail, low-friction onboarding loses value on real workloads.","GitHub issue opened February 20, 2025.",high,Clearpage should communicate when it uses lightweight fetch versus heavier rendering and when each path is likely to fail.
direct_competitor,jina-reader,hn_comment,Jina.ai offer a really neat (currently free) API for this,https://news.ycombinator.com/item?id=41429728,praise,A Hacker News user praised the prefix-based workflow for quick Markdown conversion and noted the code can be self-hosted.,Users value one-line onboarding and immediate usefulness for LLM workflows.,"Hacker News comment posted September 2, 2024.",medium,Clearpage should preserve extremely low-friction first success for single-URL extraction.
direct_competitor,jina-reader,hn_comment,"If you need this sort of thing in any other language, there's a free, no-auth, no-api-key-required API",https://news.ycombinator.com/item?id=42094064,complaint,A Hacker News user said Jina Reader does most jobs well but still fails on some Cloudflare-protected sites.,"Users accept some failure, but they want to know the likely coverage boundary before depending on the tool.","Hacker News comment posted November 9, 2024.",medium,Clearpage should communicate coverage limits honestly and offer fallback guidance when protected pages are likely to fail.
direct_competitor,apify-crawlee,github_issue,The request queue scans all 450k (99.999% of which are done towards the end) requests for each iteration,https://github.com/apify/crawlee/issues/2406,complaint,Large crawls can slow badly near completion because the queue keeps scanning massive numbers of already-done requests.,"Scale-path inefficiency directly affects runtime, infrastructure cost, and trust in long jobs.","GitHub issue opened April 7, 2024.",high,"If Clearpage adds large recurring queues, it should avoid opaque end-of-job slowdown and expose queue-state efficiency metrics."
direct_competitor,apify-crawlee,github_discussion,How do I use Apify proxies with Crawlee?,https://github.com/apify/crawlee-python/discussions/575,complaint,"A user struggled to verify proxy usage, understand retries and sessions, and debug repeated 403s despite proxy setup.","Users care about observability and controllability when anti-bot defenses appear, not just proxy features on paper.","GitHub discussion active October 6-7, 2024.",high,"Clearpage should make retry, proxy, and fallback behavior inspectable in logs or UI if it exposes advanced crawling paths."
direct_competitor,apify-crawlee,github_discussion,Handling Errors from failedRequestHandler in Single URL Flow with PlaywrightCrawler,https://github.com/apify/crawlee/discussions/2175,workaround_signal,"A user needed failedRequestHandler errors to reach the main execution flow, and the accepted path required custom promise rejection plumbing.",Users want central error handling without building their own control wrappers.,"GitHub discussion opened November 8, 2023; workaround answer posted November 16, 2023.",medium,Clearpage should keep failure propagation simple and first-class for agent or batch consumers.
direct_competitor,apify-crawlee,github_discussion,How can I mark requests in the queue as unprocessed?,https://github.com/apify/crawlee/discussions/1232,feature_request,A user asked for a way to move queued requests back into an unprocessed state.,Queue-state control matters when crawls fail midway or need targeted reruns.,"GitHub discussion opened November 6, 2021.",medium,Clearpage should design rerun and replay controls deliberately if it expands beyond one-shot extraction.
direct_competitor,crawl4ai,github_issue,[Bug]: Markdown export loses heading hierarchy and table structure,https://github.com/unclecode/crawl4ai/issues/1964,complaint,A user reported that Crawl4AI markdown export loses heading hierarchy and table structure.,"Broken structure hurts RAG chunk quality, document fidelity, and downstream extraction accuracy.","Opened May 11, 2026; still listed open in the captured issues view.",high,Clearpage should preserve headings and tables reliably in markdown output and make fidelity easy to verify.
direct_competitor,crawl4ai,github_issue,[Bug]: MCP scrape tools lack wait_until / SPA support that REST API and CLI provide,https://github.com/unclecode/crawl4ai/issues/1963,complaint,A user reported that Crawl4AI MCP scrape tools do not expose the same SPA wait controls available in REST API and CLI flows.,Agent users need consistent dynamic-page handling across product surfaces or they get incomplete captures.,"Opened May 11, 2026; issue list labels showed in-progress and root-caused.",high,"Clearpage should keep API, UI, and agent surfaces behaviorally aligned for dynamic-page extraction."
direct_competitor,crawl4ai,github_issue,"[Bug] MCP Server json.dumps() escapes non-ASCII characters, causing 2.5-3x token overhead for CJK content",https://github.com/unclecode/crawl4ai/issues/1962,complaint,A user reported extra escaping in MCP output that inflates token usage for CJK content.,Token overhead directly raises cost and reduces usable context for multilingual workloads.,"Opened May 10, 2026; issue list labels showed in-progress.",medium,"Clearpage should optimize transport and output for multilingual token efficiency, not just English happy paths."
direct_competitor,crawl4ai,github_discussion,[Feature Request]: Only extract visible content,https://github.com/unclecode/crawl4ai/discussions/108,feature_request,A user requested a visible-content-only extraction mode.,Users want cleaner outputs from modern pages where hidden DOM and boilerplate pollute the result.,"Started Mar 24, 2026; still listed in discussions.",medium,Clearpage should expose explicit content-scope controls like visible-only extraction.
direct_competitor,crawl4ai,github_discussion,[Feature Request]: Browserless support (ghcr.io/browserless/chromium),https://github.com/unclecode/crawl4ai/discussions/115,feature_request,A user requested browserless runtime support for Crawl4AI.,Teams want easier managed-browser deployment options without custom browser infrastructure.,"Started Apr 19, 2026; still listed in discussions.",medium,Clearpage can differentiate with simpler hosted rendering and deployment choices.
direct_competitor,crawl4ai,reddit,"Firecrawl vs Crawl4ai, I tried both and here's what i found",https://www.reddit.com/r/AgentsOfAI/comments/1t3pe4e/firecrawl_vs_crawl4ai_i_tried_both_and_heres_what/,complaint,A commenter said Crawl4AI Docker setups broke on updates and started dropping requests randomly after weeks of use.,Long-run stability matters more than a successful first demo for production pipelines.,Thread captured as published last week; comments referenced active use over four months.,high,"Clearpage should emphasize boring reliability for long-running jobs, not just feature breadth."
direct_competitor,webclaw,github_discussion,extract Hydration state from a SPA page,https://github.com/0xMassi/webclaw/discussions/13,feature_request,A user asked Webclaw to expose `__NEXT_DATA__` or hydration-state data because important fields live in page state on SPA or Next.js pages.,"Critical product data can live outside visible HTML, so plain DOM extraction is not enough.","Started Apr 2, 2026; maintainer said support was added in v0.3.5 and expanded in v0.3.6 the same day.",high,Clearpage should treat page-state extraction as a first-class structured-data feature.
direct_competitor,webclaw,github_discussion,batch with output file,https://github.com/0xMassi/webclaw/discussions/2,feature_request,"A user asked for deterministic per-page files in batch mode, including custom filenames.","Batch users need outputs that drop cleanly into local workflows, audits, and downstream automation.","Started Mar 25, 2026; maintainer said it shipped in v0.1.5 on Mar 26, 2026.",medium,Clearpage should support predictable batch exports and explicit file naming without workarounds.
direct_competitor,webclaw,reddit,"webclaw MCP server, 10 tools for web extraction, runs locally",https://www.reddit.com/r/mcp/comments/1s29yn8/webclaw_mcp_server_10_tools_for_web_extraction/,feature_request,A commenter asked whether Webclaw was a drop-in Firecrawl replacement and whether it supported third-party proxy pools.,Migration from incumbents and existing proxy setups lowers switching cost for production users.,Thread was published 1 month ago.,medium,Clearpage should make migration compatibility and proxy strategy legible up front.
direct_competitor,webclaw,reddit,"webclaw MCP server, 10 tools for web extraction, runs locally",https://www.reddit.com/r/mcp/comments/1s29yn8/webclaw_mcp_server_10_tools_for_web_extraction/,praise,A commenter said Webclaw fixes Claude's weak fetch and is worth testing for autonomous research bots.,Users care about replacing brittle default web fetch with cleaner agent-ready extraction.,Thread was published 1 month ago.,medium,"Clearpage messaging should speak directly to agent-web failure modes like 403s, raw HTML, and context waste."
direct_competitor,webclaw,reddit,"webclaw: web scraper for AI agents, built in Rust, bypasses Cloudflare without a browser",https://www.reddit.com/r/coolgithubprojects/comments/1s2cfap/webclaw_web_scraper_for_ai_agents_built_in_rust/,praise,"A commenter said that after a test drive, Webclaw would save a lot of time on a project.",Time-to-value matters for developer adoption even before teams validate deeper reliability.,Thread was published 27 days before capture.,low,Clearpage should keep onboarding and first success fast enough that users feel immediate workflow savings.
direct_competitor,crw,reddit,Best way to do web scraping / search automation in OpenClaw? (startup use case),https://www.reddit.com/r/openclaw/comments/1s8ztah/best_way_to_do_web_scraping_search_automation_in/,praise,"In a thread complaining that Tavily plus Firecrawl results were vague, unreliable, and noisy, a commenter recommended fastCRW as the fastest and lightest open-source scraper.",Users want better result quality and less operational drag in agent-based research workflows.,Thread was published 28 days before capture; recommendation comment was 23 days before capture.,medium,Clearpage should position against noisy search plus scrape stacks by proving cleaner and more reliable output quality.
direct_competitor,crw,reddit,Web search tool for openclaw,https://www.reddit.com/r/openclaw/comments/1rx9jr9/web_search_tool_for_openclaw/,workaround,"In a thread asking for free or low-friction web search, a commenter recommended fastCRW for scraping because of its 6 MB binary and cloud search support.",Low-friction setup and cost-sensitive experimentation matter for early agent builders.,Thread was published about 2 months before capture; fastCRW recommendation comment was 1 month before capture.,medium,Clearpage can win cost-sensitive users with a lightweight starter path that does not feel infrastructure-heavy.
direct_competitor,crw,product_hunt_comment,fastCRW,https://www.producthunt.com/products/fastcrw,praise,A Product Hunt commenter said they were deploying fastCRW alongside Docker instances because it was lightweight and easy to deploy.,Operational simplicity is a buying criterion for teams that already ship containerized workloads.,Comment visible on the Product Hunt page 1 month after launch.,medium,Clearpage should reduce deployment friction and make self-host or sidecar use cases obvious.
direct_competitor,crw,product_hunt_comment,fastCRW,https://www.producthunt.com/products/fastcrw,praise,A Product Hunt commenter said fastCRW uses very little RAM and works on a Raspberry Pi for crawling news.,Small-footprint deployment expands the range of environments where teams can run the tool cheaply.,Comment visible on the Product Hunt page 1 month after launch.,low,Clearpage can differentiate if it offers strong extraction without needing heavyweight runtime assumptions.
direct_competitor,browser-use,github_issue,"browser-use fails to identify/click icon-only ""Create Test"" button when tooltip is present but accessible label is missing",https://github.com/browser-use/browser-use/issues/4801,complaint,User reports that browser-use cannot reliably target an icon-only button and may click the wrong nearby control when the label is only exposed as a tooltip.,Real browser tasks break when controls are visually obvious to humans but weakly labeled in the DOM.,"Opened May 8, 2026.",high,Clearpage should expose action confidence and fallback evidence when page controls are ambiguous or weakly labeled.
direct_competitor,browser-use,github_issue,Feature Request: Too strict dependency version pinning (`==`) causes dependency conflicts in complex projects,https://github.com/browser-use/browser-use/issues/4824,feature_request,User asks for looser dependency ranges because exact pins create conflicts with shared libraries and delay patch adoption.,Teams embedding the tool into larger Python systems want easier integration and faster security or bug-fix upgrades.,"Opened May 12, 2026.",high,Clearpage should minimize integration friction and avoid packaging choices that block adoption inside existing stacks.
direct_competitor,browser-use,github_discussion,Can browser-use expose or record stable selectors (XPath/CSS) discovered during an LLM-guided run?,https://github.com/browser-use/browser-use/discussions/3856,feature_request,Users want to capture selectors from exploratory runs so they can convert successful agent behavior into deterministic Playwright automation.,"This lowers cost, improves replayability, and makes successful flows production-usable.","Question opened Jan 8, 2026; follow-up workaround discussion visible through May 10, 2026.",high,Clearpage can differentiate by turning successful exploratory extraction into reusable deterministic recipes or exportable automation evidence.
direct_competitor,browser-use,github_discussion,run into repeated infinite loop,https://github.com/browser-use/browser-use/discussions/94,complaint,User reports repeated loops and also asks how to prevent visits to unwanted domains such as Yelp.,"Runaway loops waste time and tokens, and users need route or domain guardrails.","Started Dec 8, 2024.",medium,"Clearpage should support stop conditions, domain allow-deny controls, and clearer loop detection."
direct_competitor,browser-use,reddit,browser-use sucks !!,https://www.reddit.com/r/AI_Agents/comments/1hzt9tt,workaround,"Commenters describe browser-use getting stuck on about:blank, taking too long on basic prompts, and one says they built a Chrome extension plus browser-use REST server to make it easier to use.",Users want the tool to work with less setup and less ambiguity during basic browser tasks.,Thread was published about 1.3 years ago and crawled 10 months ago in the accessible search result.,medium,Clearpage should keep first-run setup and operator feedback simple enough that users do not need wrapper tooling for basic use.
direct_competitor,scrapegraphai,github_discussion,Bot detection errors 503,https://github.com/orgs/ScrapeGraphAI/discussions/1035,complaint,User asks how to bypass HTTP 503 bot-detection failures on sites like Amazon and Zillow.,"Protected sites are common high-value targets, so failure here blocks practical use.","Asked Jan 12, 2026.",high,"Clearpage needs a clear posture for protected sites, including browser-backed fallback and honest limits."
direct_competitor,scrapegraphai,github_discussion,AJAX Pagination,https://github.com/orgs/ScrapeGraphAI/discussions/998,feature_request,User asks how to extract all items when products load through AJAX and the base URL never changes.,Dynamic pagination is a common real-world pattern that breaks simple crawl assumptions.,"Asked Jul 1, 2025.",high,Clearpage should handle dynamic list expansion and document how it detects completion on same-URL pages.
direct_competitor,scrapegraphai,github_discussion,Sign-In before Scraping,https://github.com/orgs/ScrapeGraphAI/discussions/997,workaround,User asks how to scrape pages behind login; the recommended workaround is to log in with Playwright and pass saved session state into ScrapeGraphAI.,"Authenticated pages often contain the highest-value data, so users need a workable session handoff path.","Asked Jul 1, 2025.",high,Clearpage should support session reuse or browser-state import rather than assuming public unauthenticated pages only.
direct_competitor,scrapegraphai,github_issue,Verbose mode is not providing useful information,https://github.com/ScrapeGraphAI/Scrapegraph-ai/issues/1045,complaint,User says verbose mode is not enough to diagnose poor results on simple pages and asks for DEBUG-level visibility into model context and malformed JSON responses.,"Without usable debugging, users cannot trust or fix extraction failures.","Opened Mar 5, 2026.",high,"Clearpage should provide extraction traces, raw evidence, and explicit failure reasons instead of shallow logging."
direct_competitor,scrapegraphai,github_discussion,Export scrapped website to markdown?,https://github.com/orgs/ScrapeGraphAI/discussions/807,feature_request,User asks for a direct way to export crawler output to markdown and says the crawler seems capable but the export path is not obvious.,"Users want extraction plus usable output in one step, not a vague post-processing path.","Asked Nov 18, 2024.",medium,"Clearpage should keep export formats explicit and low-friction, especially for markdown-like outputs."
direct_competitor,webpeel,github_issues_index,WebPeel public issue index showed no open issues in this pass,https://github.com/webpeel/webpeel/issues,source_gap,No concrete public issue backlog was visible for WebPeel in the prioritized public sources used in this pass.,Sparse public feedback makes demand harder to validate and compare against the rest of the cohort.,Observed during Stage 3 capture on 2026-05-16.,low,Treat WebPeel as a weaker public-demand comparator until more public feedback surfaces are visible.
adjacent_tool,playwright-mcp,github_issue,Dealing with big pages and context between client and the MCP server,https://github.com/microsoft/playwright-mcp/issues/1040,complaint,User reports that large pages can produce roughly 50k-token MCP responses and fill the client context quickly.,High token usage makes browser-assisted extraction expensive and brittle inside real agent workflows.,"Opened September 15, 2025.",high,Clearpage should avoid sending verbose page state by default and keep browser-heavy flows opt-in.
adjacent_tool,playwright-mcp,reddit,Playwright MCP performance issue,https://www.reddit.com/r/Playwright/comments/1rfhtu6/playwright_mcp_performance_issue/,complaint,Commenters say Playwright MCP consumes many tokens and can hit rate limits because too much page structure is sent to the AI.,"Users feel the cost directly in latency, usage limits, and failed runs.","Published February 26, 2026.",high,Clearpage should optimize extraction paths for low-context output before escalating to browser state.
adjacent_tool,playwright-mcp,github_issue,Missing prerequisite steps in Getting Started documentation,https://github.com/microsoft/playwright-mcp/issues/1113,complaint,"User says setup docs skip prerequisite browser-install steps, which creates confusing first-run failures.",Onboarding friction blocks adoption before users even test value.,"Opened October 5, 2025.",high,Clearpage should keep setup hidden or automatic wherever possible.
adjacent_tool,playwright-mcp,github_issue,"[Feature] Add a highlighter while tracing and clicking elements for actions like (eg,click, locate)",https://github.com/microsoft/playwright-mcp/issues/492,feature_request,User asks for a visible highlighter so operators can see what the agent is targeting while it clicks or locates elements.,People need confidence and debuggability when an agent acts inside a real browser.,"Opened May 29, 2025.",medium,Clearpage should expose action previews or evidence when automation touches the browser.
adjacent_tool,playwright-mcp,github_issue,Security consideration: Indirect Prompt Injection via accessibility snapshots in MCP browser sessions,https://github.com/microsoft/playwright-mcp/issues/1479,complaint,Issue flags prompt-injection risk because accessibility snapshots are passed directly into the model context.,Security risk becomes part of product trust when browser content is fed to an LLM.,"Opened March 21, 2026.",high,"Clearpage should treat browser-fed model context as a security boundary, not a neutral transport."
adjacent_tool,playwright-mcp,reddit,"If you haven't already, learn Playwright MCP",https://www.reddit.com/r/Playwright/comments/1su23v4/if_you_havent_already_learn_playwright_mcp/,praise,User reports strong results for generating tests and debugging page behavior with Playwright MCP.,The browser path is clearly valuable when users need page-aware automation rather than plain text extraction.,"Published April 24, 2026.",medium,Clearpage can keep browser assistance as a premium fallback for high-value interactive cases.
adjacent_tool,trafilatura,github_issue,Is this project dead?,https://github.com/adbar/trafilatura/issues/846,complaint,"User worries about release stagnation, dependency drift, and unresolved security handling.","Teams avoid tools that look abandoned, especially in production scraping stacks.","Opened May 8, 2026.",high,Clearpage should signal active maintenance and quick issue response if extraction becomes core product value.
