scope,subject,source_type,source_title,source_url,signal_type,signal_summary,why_users_care,recency_note,severity,clearpage_implication
adjacent_tool,trafilatura,github_issue,Markdown output drops spaces after inline formatting inside list items,https://github.com/adbar/trafilatura/issues/845,complaint,Markdown serialization can drop spaces around inline formatting inside list items.,Small markdown bugs damage trust because downstream AI and users consume the exact text output.,"Opened May 5, 2026.",medium,Clearpage should preserve formatting fidelity and test markdown edge cases explicitly.
adjacent_tool,trafilatura,github_issue,Intermittent SEGV during concurrent extract() calls,https://github.com/adbar/trafilatura/issues/840,complaint,Concurrent extract calls can intermittently crash the Python process with segmentation faults.,Batch workloads and multi-threaded pipelines need stability more than benchmark demos.,"Opened April 10, 2026.",high,Clearpage should prefer concurrency-safe extraction paths and isolate risky native dependencies.
adjacent_tool,trafilatura,github_issue,Keeping images breaks parsing,https://github.com/adbar/trafilatura/issues/842,complaint,Enabling image preservation can break parsing and destabilize markdown output.,Users want media-aware extraction without having to choose between images and reliable text.,"Opened April 29, 2026.",medium,Clearpage should make media retention a tested capability instead of an afterthought.
adjacent_tool,trafilatura,hacker_news,"Show HN: Defuddle, an HTML-to-Markdown alternative to Readability",https://news.ycombinator.com/item?id=44067409,praise,A commenter says trafilatura gave the best quality content with accurate metadata in their comparisons.,Extraction quality still wins users when the parser handles common article pages well.,HN thread published about 9 months before the crawl snapshot.,medium,Clearpage should preserve the quality bar on article-like pages even while expanding to harder targets.
adjacent_tool,mozilla-readability,github_issue,BBC news articles not containing full article body,https://github.com/mozilla/readability/issues/1005,complaint,Reader extraction can omit large sections of some BBC articles.,"Missing body content is a hard failure for summarization, indexing, and user trust.","Opened March 15, 2026.",high,Clearpage needs completeness checks before presenting extraction as final.
adjacent_tool,mozilla-readability,github_pull,Optionally keep original title headers for main content extraction accuracy,https://github.com/mozilla/readability/pull/1006,feature_request,Request asks for an option to preserve original title headers because reader-mode normalization can hurt extraction accuracy.,Formatting decisions that help reader mode can hurt downstream parsing use cases.,"Opened April 17, 2026.",medium,Clearpage should separate presentation cleanup from source-faithful export.
adjacent_tool,mozilla-readability,github_issue,Add options to set max title length or false not to limit at all,https://github.com/mozilla/readability/issues/1002,feature_request,User asks for control over title trimming instead of hardcoded limits.,Users want predictable metadata and fewer silent transformations.,"Opened February 16, 2026.",medium,Clearpage should expose metadata controls instead of silently rewriting fields.
adjacent_tool,mozilla-readability,hacker_news,Rdrview – Firefox Reader View as a Linux command line tool,https://news.ycombinator.com/item?id=24825417,praise,A user comparison says mozilla/readability performed best for consistent primary-content extraction with minimal semantic mangling.,The library remains a trusted baseline for article extraction quality.,"HN thread published October 19, 2020.",medium,Clearpage should match strong article extraction before claiming broader coverage.
adjacent_tool,mozilla-readability,hacker_news,2markdown – Transform Websites into Markdown,https://news.ycombinator.com/item?id=40228605,complaint,Commenter says Readability works well on article or blog pages but fails badly on more structured pages like API docs.,"Users expect one tool to cover more than news articles, especially for AI knowledge ingestion.","HN thread published May 1, 2024.",high,Clearpage should route documentation-like pages differently from article-like pages.
adjacent_tool,webustler,docs,Webustler README,https://github.com/DrRuin/webustler,praise,"The public README centers on Cloudflare-protected sites, clean markdown, self-hosting, and no per-request API fees as its main value claims.",This shows that protected-site access and low-cost self-hosting are real user jobs in the category.,Repo surfaced with latest public update in February 2026.,medium,Clearpage should stay explicit about what protected-site handling it does and does not support.
adjacent_tool,webustler,github_repo,DrRuin/webustler issue surface,https://github.com/DrRuin/webustler/issues,source_gap,"The public repo showed only two open items during this pass, and both were pull requests rather than user-reported issues.",There is not enough public troubleshooting volume to infer stable demand patterns.,"Checked May 16, 2026.",medium,Clearpage should treat webustler as a weak comparator for demand sizing.
adjacent_tool,webustler,public_web,Webustler public community surface gap,https://github.com/DrRuin/webustler,source_gap,"No clear Reddit thread, Hacker News thread, or active public discussion surface with concrete user pain points was visible in this pass.","Thin public signal makes it hard to tell whether the product is early, private-community-led, or simply low adoption.","Checked May 16, 2026.",medium,Clearpage should not overweight webustler in roadmap decisions without stronger evidence.
adjacent_tool,crawl4ai-mcp-server,docs,Crawl4AI MCP Server README,https://github.com/BjornMelin/crawl4ai-mcp-server,source_gap,The standalone README says the MCP server is under development and not ready for production use.,Early-stage status means the public issue surface may reflect setup curiosity more than mature production pain.,"README visible May 16, 2026.",medium,"Clearpage should read this tool as directional evidence, not as a mature benchmark."
adjacent_tool,crawl4ai-mcp-server,github_issue,How can I use with Claude Desktop?,https://github.com/BjornMelin/crawl4ai-mcp-server/issues/19,complaint,User asks how to use the server with Claude Desktop.,Client compatibility and onboarding are basic adoption gates for MCP tools.,"Opened May 21, 2025.",medium,Clearpage should minimize client-specific setup steps if it exposes MCP-style integrations.
adjacent_tool,crawl4ai-mcp-server,github_issue,feat: configure local hosting option with npx/Node,https://github.com/BjornMelin/crawl4ai-mcp-server/issues/15,feature_request,Request asks for a local Node-hosted option instead of relying only on remote deployment.,Teams want simpler local development and fewer hosted dependencies.,"Opened May 4, 2025.",medium,Clearpage should keep local and hosted execution paths aligned where possible.
adjacent_tool,crawl4ai-mcp-server,github_issue,"[Bug] AsyncLogger writes to stdout, breaking MCP stdio transport",https://github.com/unclecode/crawl4ai/issues/1968,complaint,Core Crawl4AI issue says stdout logging breaks MCP stdio transport when used inside an MCP server.,Transport correctness is non-negotiable for agent integrations.,"Opened May 13, 2026.",high,Clearpage should keep machine-readable channels clean and separate from logs.
adjacent_tool,crawl4ai-mcp-server,github_issue,[Bug]: MCP scrape tools lack wait_until / SPA support that REST API and CLI provide,https://github.com/unclecode/crawl4ai/issues/1963,complaint,Users report that MCP scrape tools are missing wait and SPA controls that exist elsewhere in the product.,Dynamic pages fail if MCP wrappers expose a weaker control surface than the underlying crawler.,"Opened May 11, 2026.",high,"Clearpage should give the same dynamic-page controls across UI, API, and automation surfaces."
adjacent_tool,crawl4ai-mcp-server,github_issue,[Bug]: Markdown export loses heading hierarchy and table structure,https://github.com/unclecode/crawl4ai/issues/1964,complaint,User says markdown export can flatten heading hierarchy and lose table structure.,Structural loss hurts downstream AI retrieval and human readability.,"Opened May 11, 2026.",high,Clearpage should preserve document structure in exports and show when fidelity drops.
adjacent_tool,crawl4ai-mcp-server,github_issue,"[Bug] MCP Server json.dumps() escapes non-ASCII characters, causing 2.5-3x token overhead for CJK content",https://github.com/unclecode/crawl4ai/issues/1962,complaint,Escaped non-ASCII output increases token cost sharply for CJK content.,Multilingual users pay more when transport formatting is wasteful.,"Opened May 10, 2026.",high,Clearpage should treat multilingual token efficiency as a first-class requirement.
adjacent_tool,teracrawl,docs,Teracrawl README,https://github.com/BrowserCash/teracrawl,complaint,The README says /crawl requires a separate browser-serp service and that the product is powered by Browser.cash remote browsers.,Extra services and hosted dependencies increase setup burden and lock-in risk.,"README checked May 16, 2026.",high,Clearpage should avoid hidden infrastructure dependencies for core extraction paths.
adjacent_tool,teracrawl,github_issue,Using SearXNG instead of browser-serp,https://github.com/BrowserCash/teracrawl/issues/1,feature_request,User asks whether an existing SearXNG instance can replace browser-serp for the crawl endpoint.,Users want to reuse their own search stack instead of adopting another required service.,"Opened February 18, 2026.",medium,Clearpage should reuse common infrastructure where possible instead of forcing a bespoke stack.
adjacent_tool,teracrawl,reddit,Fire crawl getting blocked due to Headlessness,https://www.reddit.com/r/aiagents/comments/1pdt3ku/fire_crawl_getting_blocked_due_to_headlessness/,workaround,A commenter recommends Teracrawl because it uses a headful Chrome browser API when headless scraping gets blocked.,Protected sites remain a major reason users seek browser-backed alternatives.,Published about 5 months before the crawl snapshot.,medium,Clearpage should reserve browser-backed fetching for sites where simple extraction clearly fails.
adjacent_tool,teracrawl,public_web,Teracrawl: Why the #1 Scraping Benchmark Winner Depends on External Services,https://starlog.is/articles/developer-tools/browsercash-teracrawl,complaint,"Public analysis says Teracrawl cannot run without a Browser.cash API key and also depends on browser-serp, framing a strong lock-in tradeoff.","High scraping success is attractive, but mandatory external services can block adoption.",Published April 2026.,high,Clearpage should be explicit about dependency tradeoffs when offering higher-success fallback paths.
adjacent_tool,browserpilot,github_issue,v1.3.0: Crawl Anything — pagination + full-site crawling,https://github.com/ai-naymul/BrowserPilot/issues/25,feature_request,Users want automatic pagination detection and full-site crawling instead of single-page extraction only.,People quickly outgrow one-page workflows once they trust the browser agent.,"Opened May 5, 2026.",high,Clearpage should plan for multi-page collection if it wants to compete beyond one-shot page extraction.
adjacent_tool,browserpilot,github_issue,v1.2.0: Universal Proxy System with SOCKS4/5 support,https://github.com/ai-naymul/BrowserPilot/issues/24,feature_request,Request asks for broader proxy infrastructure including SOCKS4 and SOCKS5 support.,Proxy control matters once users target protected or geo-sensitive sites.,"Opened May 5, 2026.",medium,"Clearpage should treat proxy support as an advanced capability, not an afterthought, if it enters protected-site workflows."
adjacent_tool,browserpilot,github_issue,add openrouter support/multi model supports,https://github.com/ai-naymul/BrowserPilot/issues/22,feature_request,User asks for broader model-provider support through OpenRouter or multiple models.,Teams want cost control and provider flexibility.,"Opened October 25, 2025.",medium,Clearpage should avoid hard-coupling extraction intelligence to one model vendor.
adjacent_tool,browserpilot,github_issue,add ollama or local model support,https://github.com/ai-naymul/BrowserPilot/issues/16,feature_request,User asks for local model support.,"Some users want privacy, lower cost, or offline experimentation.","Opened September 17, 2025.",medium,Clearpage can win trust by keeping some processing paths provider-agnostic.
adjacent_tool,browserpilot,github_issue,Vulnerability Report: Code Injection Vulnerability in gpt_selenium_agent.py due to Flawed _check_danger and exec() Execution in __step_through_instructions,https://github.com/handrew/browserpilot/issues/21,complaint,Public vulnerability report says BrowserPilot had a code-injection risk through exec-based instruction execution.,Security concerns can outweigh automation convenience in browser agents.,"Opened April 16, 2025.",high,Clearpage should avoid unsafe execution patterns in any agentic automation layer.
adjacent_tool,browserpilot,hacker_news,BrowserPilot: Natural language browser automation,https://news.ycombinator.com/item?id=34811945,praise,HN launch thread confirms baseline appeal for plain-English browser automation without bespoke scripts.,The product category is attractive because it lowers the skill barrier to automation.,"HN thread published February 15, 2023.",medium,Clearpage can borrow the plain-language promise without inheriting unsafe or overly broad agent scope.
community_review,firecrawl,reddit_thread,firecrawl or custom web scraping?,https://www.reddit.com/r/scrapingtheweb/comments/1qh8oap/firecrawl_or_custom_web_scraping/,complaint,User says Firecrawl works on harder sites but feels too expensive for recurring product-price scraping compared with building something simpler.,"Recurring extraction turns pricing shape into a product decision, not a billing footnote.","Published January 19, 2026.",medium,Clearpage should make repeat-job economics legible and avoid flat black-box pricing signals.
community_review,firecrawl,reddit_thread,Any pay-as-you-go scrapers that don't expire credits monthly? (Firecrawl alt),https://www.reddit.com/r/n8n/comments/1q4eccq/any_payasyougo_scrapers_that_dont_expire_credits/,complaint,User says Firecrawl is solid for research agents in n8n but monthly credits that vanish during idle months create anxiety for bursty workloads.,Bursty users dislike paying a retainer just to keep an API available between runs.,"Published January 5, 2026.",medium,Clearpage should consider burst-friendly pricing or usage framing for intermittent research workflows.
community_review,firecrawl,product_hunt_review,Firecrawl | The Web Data API for AI Agents and Developers,https://www.producthunt.com/products/extract-by-firecrawl?page=1,praise,Reviewers say Firecrawl reliably turns messy web pages into useful structured data and saves hours that would otherwise go into manual research or brittle scraping.,Users reward tools that produce immediate time savings on real workflows.,"Review page visible on May 16, 2026; referenced reviews posted 5-10 months earlier.",medium,Clearpage should preserve a very fast first win and connect it directly to measurable time saved.
community_review,firecrawl,product_hunt_review,Firecrawl | The Web Data API for AI Agents and Developers,https://www.producthunt.com/products/extract-by-firecrawl?page=1,feature_request,A Product Hunt reviewer asks for deeper multi-step search that can follow related sources and enrich incomplete entities automatically.,Users move quickly from single-page extraction to research-style enrichment once the base scrape works.,"Review page visible on May 16, 2026; most informative request shown as 5 months old.",high,Clearpage can differentiate with traceable multi-source enrichment instead of one-page-only output.
community_review,jina-reader,hn_comment,Jina.ai offer a really neat (currently free) API for this,https://news.ycombinator.com/item?id=41429728,praise,Hacker News users praise Jina Reader as a no-auth one-liner that quickly returns Markdown suitable for LLM use.,Immediate usefulness lowers onboarding friction and makes experimentation cheap.,"Comment posted September 2, 2024.",medium,Clearpage should keep single-URL first success extremely fast and obvious.
community_review,jina-reader,hn_comment,"If you need this sort of thing in any other language, there's a free, no-auth, no-api-key-required API",https://news.ycombinator.com/item?id=42094064,complaint,A Hacker News user says Jina Reader does most jobs well but still fails on some Cloudflare-protected sites.,Users accept partial coverage only if the boundary is obvious before production dependence.,"Comment posted November 9, 2024.",medium,Clearpage should communicate coverage boundaries honestly and expose fallback options for protected pages.
community_review,jina-reader,reddit_thread,"What is best format for data source for a RAG vector database? JSON, XML, CSV, or Other?",https://www.reddit.com/r/LanguageTechnology/comments/1bim5f8,complaint,A Reddit commenter says Jina-style cleaned pages can duplicate the first 80-100 lines across URLs and sometimes miss information they wanted.,Cleaned text that duplicates or omits facts weakens trust and retrieval quality.,"Comment posted August 1, 2024.",medium,Clearpage should surface duplication or omission risk and make source-to-output provenance easy to inspect.
community_review,jina-reader,reddit_thread,rebuild data tables from jina.ai - Use r.jina.ai to read a URL,https://www.reddit.com/r/webscraping/comments/1itt89q,complaint,"A user says the raw text came back, but turning it into structured tables was still hard.",Users do not only want readable text; they also want predictable structure for downstream use.,"Published February 20, 2025.",medium,Clearpage should keep structure-preserving extraction explicit rather than assuming markdown alone is enough.
community_review,jina-reader,source_gap,Public review gap for Jina Reader,https://github.com/jina-ai/reader,source_gap,"Public conversation is dense in tips and recommendations, but thin in detailed independent review pages or Product Hunt style feedback for Reader itself.",Sparse review depth makes it harder to see switching reasons and long-run sentiment in public.,"Observed May 16, 2026.",low,Clearpage should not overfit to Jina's public praise without stronger evidence about production satisfaction.
community_review,crawl4ai,reddit_thread,"Firecrawl vs Crawl4ai, I tried both and here's what i found",https://www.reddit.com/r/AgentsOfAI/comments/1t3pe4e/firecrawl_vs_crawl4ai_i_tried_both_and_heres_what/,complaint,"User says Crawl4AI took about an hour to set up, Docker was fiddly, JS-heavy sites were hit or miss, and the self-hosted setup became a debugging burden.",Operational drag changes a free tool into an expensive one once maintenance time is counted.,"Published May 4, 2026.",high,Clearpage should minimize environment friction and make browser-backed behavior more dependable on hard pages.
community_review,crawl4ai,reddit_thread,Web Crawlers and AI,https://www.reddit.com/r/AI_Agents/comments/1rka70u/web_crawlers_and_ai/,complaint,A commenter says Crawl4AI is good for downloading content but its configuration is a bit challenging.,"Users value capability, but confusing setup slows adoption and supportability.","Published March 2, 2026.",medium,Clearpage should keep advanced power available without making configuration feel like a hurdle.
community_review,crawl4ai,hn_thread,Show HN: Crawl4AI – Open-Source Web Crawler for LLMs and Structured Data,https://news.ycombinator.com/item?id=46646798,complaint,"The HN pitch for an unofficial Crawl4AI guide says new developers struggle with production configurations, MCP setup, and n8n bridging.","When a tool spawns unofficial setup hubs, that is a public signal that the official path still feels confusing.","HN thread visible 55 days before May 16, 2026.",medium,"Clearpage should ship opinionated docs for production, MCP, and automation-tool paths before users need community patchwork."
community_review,browser-use,reddit_thread,Why does browser use suck?,https://www.reddit.com/r/AI_Agents/comments/1o67dj5/why_does_browser_use_suck/,complaint,"Commenters say browser-use breaks because UIs change constantly, auth flows break, anti-bot gets in the way, and context or state verification issues pile up.","Agent browser automation is judged on whether it survives messy reality, not just demos.","Published October 15, 2025.",high,Clearpage should design around bounded failure and state verification instead of optimistic happy-path claims.
community_review,browser-use,reddit_thread,browser-use sucks !!,https://www.reddit.com/r/AI_Agents/comments/1hzt9tt,complaint,"Users report infinite loops, about:blank stalls, long runtimes on basic tasks, and unclear result reporting; one commenter says they built wrapper tooling to make it usable.","If users need wrappers for basic control and clarity, trust collapses quickly.",Thread published about 1.3 years before the accessible crawl snapshot.,high,Clearpage should keep operator feedback and result reporting clear enough that basic use does not require wrapper tooling.
community_review,browser-use,hn_thread,Launch HN: Browser Use (YC W25) – open-source web agents,https://news.ycombinator.com/item?id=43173378,complaint,HN commenters say one site blocked them as a bot within seconds and another says the Reddit quickstart example could not complete its task.,Public failure on first trials damages confidence in real-site coverage.,"Thread posted February 25, 2025.",high,Clearpage should be explicit about anti-bot posture and should not imply first-run success on hostile sites without evidence.
community_review,browser-use,product_hunt_review,Browser Use: Make websites accessible for agents,https://www.producthunt.com/products/browser-use,praise,"Reviewers praise Browser Use for reducing Selenium or LangChain glue work, exposing chain-of-thought style journey tracking, and giving a GIF of the run afterward.","Users value not just automation, but post-run evidence that helps them understand what happened.","Review page visible May 16, 2026; highlighted reviews were 8-12 months old.",medium,"Clearpage should treat replay and extraction evidence as a core experience, not optional polish."
community_review,browser-use,product_hunt_review,Browser Use: Make websites accessible for agents,https://www.producthunt.com/products/browser-use,praise,A reviewer says Browser Use was easy to integrate for login-required browsing through the user's real browser.,"Authenticated workflows are high-value, so easy session reuse is a major adoption lever.","Review page visible May 16, 2026; highlighted review was 12 months old.",medium,Clearpage should make authenticated-session reuse or import simple if it targets serious research workflows.
community_review,scrapegraphai,product_hunt_review,ScrapeGraphAI: Turn websites into APIs,https://www.producthunt.com/products/scrapegraphai,praise,The Product Hunt page shows a positive review footprint and frames ScrapeGraphAI as fast enough for structured extraction use cases like lead enrichment and KYB automation.,Speed-to-usable-JSON is a key buying signal for teams that care more about output than crawling internals.,"Product Hunt page visible May 16, 2026; review footprint is small.",medium,"Clearpage should tie output usefulness to concrete tasks, not only generic scraping claims."
community_review,scrapegraphai,product_hunt_comment,ScrapeGraphAI launch discussion,https://www.producthunt.com/products/scrapegraphai,feature_request,"Public launch questions focus on whether the tool can handle multiple pages, JavaScript-driven pagination, and schema control instead of only one-page prompt extraction.",Users quickly push past the demo and ask whether the tool survives realistic site behavior and controlled outputs.,"Launch page visible May 16, 2026.",high,Clearpage should make pagination behavior and output-schema control explicit in-product and in docs.
community_review,scrapegraphai,source_gap,Independent review gap for ScrapeGraphAI,https://www.producthunt.com/products/scrapegraphai,source_gap,"Outside GitHub and Product Hunt, independent public review coverage for ScrapeGraphAI was sparse in this pass.",Sparse independent discussion makes it harder to separate launch energy from durable user sentiment.,"Observed May 16, 2026.",medium,"Clearpage should treat ScrapeGraphAI as a useful comparator on positioning, but not as a richly validated public-sentiment benchmark yet."
community_review,webclaw,reddit_thread,webclaw hit almost 400 GitHub stars in 8 days here's what it does and what's next,https://www.reddit.com/r/ClaudeAI/comments/1s9syoj/webclaw_hit_almost_400_github_stars_in_8_days/,complaint,"A technical commenter says trust and product clarity are weak points: the local-versus-cloud boundary feels unclear, messaging feels overstated, and independent tests still found edge-case extraction failures.",Users hesitate when a tool's success envelope and deployment boundary are not explicit.,"Published April 1, 2026.",high,"Clearpage should be extremely concrete about local limits, cloud escalation, and where extraction reliability degrades."
