scope,subject,source_type,source_title,source_url,signal_type,signal_summary,why_users_care,recency_note,severity,clearpage_implication
community_review,webclaw,reddit_thread,webclaw hit almost 400 GitHub stars in 8 days here's what it does and what's next,https://www.reddit.com/r/ClaudeAI/comments/1s9syoj/webclaw_hit_almost_400_github_stars_in_8_days/,complaint,Another commenter says Webclaw worked perfectly locally but failed against a Vercel security checkpoint when moved to a cloud server.,A tool that works locally but not in cloud deployment creates a painful trust break for production use.,"Published April 1, 2026.",high,Clearpage should distinguish local success from deployed success and expose site-defense evidence when behavior changes across environments.
community_review,webclaw,source_gap,Independent review gap for Webclaw,https://github.com/0xMassi/webclaw,source_gap,"Public discussion exists, but much of it is founder-authored or founder-adjacent rather than broad third-party review coverage.",Sparse independent validation makes public sentiment noisier and more marketing-shaped.,"Observed May 16, 2026.",medium,"Clearpage should use Webclaw as a signal for emerging expectations, but should discount hype-heavy surfaces."
community_review,crw,reddit_thread,Best way to do web scraping / search automation in OpenClaw? (startup use case),https://www.reddit.com/r/openclaw/comments/1s8ztah/best_way_to_do_web_scraping_search_automation_in/,praise,A commenter recommends fastCRW as the fastest and lightest open-source scraper when others describe noisy or unreliable search-plus-scrape stacks.,Lightweight deployment and clean output are meaningful switching reasons for early agent builders.,"Thread published April 18, 2026; recommendation comment was 23 days before prior capture.",medium,Clearpage should keep the starter path lightweight enough that users do not feel pushed into heavy infrastructure.
community_review,crw,reddit_thread,Web search tool for openclaw,https://www.reddit.com/r/openclaw/comments/1rx9jr9/web_search_tool_for_openclaw/,praise,A commenter recommends fastCRW because of its tiny binary and low-friction cloud search support for cost-sensitive experimentation.,Users in early agent workflows care about setup weight almost as much as extraction quality.,Thread published around March 2026; recommendation comment was about one month before prior capture.,medium,Clearpage should reduce install and run friction for users exploring extraction inside agent workflows.
community_review,crw,public_blog,"I couldn't stand waiting 4.6s per page on Firecrawl, so I wrote my own web scraper in Rust",https://dev.to/us/i-couldnt-stand-waiting-46s-per-page-on-firecrawl-so-i-wrote-my-own-web-scraper-in-rust-2h46,complaint,"The public writeup says CRW is still evolving and calls out missing WebSocket streaming, missing screenshot or PDF capture, and docs that are still growing.","Early adopters can tolerate speed-first tradeoffs, but production teams notice maturity gaps quickly.","DEV post visible May 16, 2026.",medium,Clearpage can differentiate by pairing low-friction operation with a more mature evidence and feature surface.
community_review,crw,source_gap,Independent review gap for CRW,https://github.com/us/crw,source_gap,Independent public review coverage for CRW was the thinnest in this pass; visible signals were mostly community recommendations and launch-style writing.,"Thin public review depth limits confidence about churn reasons, onboarding pain, and long-run reliability sentiment.","Observed May 16, 2026.",high,Clearpage should explicitly mark CRW as a sparse-evidence comparator when weighing its public traction.
domain_painpoint,web_to_markdown_fidelity,github_issue,Code blocks lose formatting when converting from HTML to markdown,https://github.com/unclecode/crawl4ai/issues/325,complaint,"[Verified] Crawl4ai users reported that HTML pre/code blocks were flattened, removing line breaks and indentation in Markdown output.",[Verified] Users need readable and structurally faithful Markdown because broken formatting damages downstream extraction and human review.,"[Verified] GitHub issue opened December 6, 2024.",high,[Inference] Clearpage should preserve structural fidelity for code-like and layout-sensitive content and surface when fidelity is degraded.
domain_painpoint,web_to_markdown_fidelity,github_issue,[Bug]: result formats markdown and cleaned_html will include damaged html tables,https://github.com/unclecode/crawl4ai/issues/756,complaint,[Verified] Crawl4ai users reported table corruption in Markdown and cleaned HTML because empty columns were removed.,"[Verified] Broken tables make extracted data unreliable for LLM parsing, spreadsheet transfer, and operator trust.","[Verified] GitHub issue opened February 27, 2025.",high,[Inference] Clearpage should treat tables as a high-risk fidelity area and provide explicit quality signals for structured outputs.
domain_painpoint,web_to_markdown_fidelity,github_issue,Academic PDF conversion outputs non-standard Markdown with broken formatting,https://github.com/microsoft/markitdown/issues/1845,complaint,[Verified] MarkItDown users reported broken Markdown formatting on academic PDF conversion.,"[Verified] Long-form documents lose value if headings, citations, lists, and layout collapse during conversion.","[Verified] GitHub issue opened April 28, 2026.",high,[Inference] Clearpage should avoid broad PDF-to-Markdown confidence claims without document-class testing and fallback messaging.
domain_painpoint,js_heavy_pages_and_spa_timing,github_issue,Unable to crawl heavy Javascript based website,https://github.com/jina-ai/reader/issues/1148,complaint,[Verified] Jina Reader users reported failure on JS-heavy websites.,"[Verified] Real customer targets increasingly depend on client-side rendering, hydration, and delayed content population.","[Verified] GitHub issue opened February 20, 2025.",high,[Inference] Clearpage should make render strategy and wait behavior visible so users can understand SPA coverage boundaries.
domain_painpoint,bot_protection_and_cloudflare,github_issue,[Self-Host] Firecrawl fails on sites with strong anti-bot measures where Browserless.io succeeds on the same host,https://github.com/firecrawl/firecrawl/issues/2257,complaint,[Verified] Firecrawl users reported failure on strong anti-bot sites in self-hosted mode even on infrastructure where Browserless succeeded.,[Verified] Users care because anti-bot failures can invalidate the tool for high-value targets even when network access and browser mode exist.,"[Verified] GitHub issue opened October 7, 2025.",high,[Inference] Clearpage should expose anti-bot failure classification and avoid presenting browser rendering as an automatic bypass.
domain_painpoint,bot_protection_and_cloudflare,github_issue,Cloudflare detecting pupeteer,https://github.com/berstend/puppeteer-extra/issues/841,complaint,[Verified] A Puppeteer Extra user reported Cloudflare blocking access even when simply connecting to the browser.,"[Verified] Detection risk can appear before page interaction, which means browser automation alone is not a reliable anti-bot answer.","[Verified] GitHub issue opened November 28, 2022.",medium,[Inference] Clearpage should communicate that browser-based extraction still has fingerprinting limits and may need fallback or explicit non-support messaging.
domain_painpoint,authenticated_pages_and_session_reuse,reddit_post,"We built authenticated scraping into our API, store your cookies once and scrape logged-in pages on every request",https://www.reddit.com/r/scrapingtheweb/comments/1s7eyqf/we_built_authenticated_scraping_into_our_api/,signal,[Verified] The post framed reusable saved-cookie sessions as the product abstraction users want for logged-in scraping.,[Verified] Users care because the highest-value pages are often behind authentication and repeated cookie injection is operationally clumsy.,"[Verified] Reddit post published May 2, 2026.",medium,"[Inference] If Clearpage moves into authenticated extraction, session objects or session IDs are likely a clearer user model than raw cookie blobs."
domain_painpoint,authenticated_pages_and_session_reuse,reddit_post,Phone-native alternative to login scraping using real sessions,https://www.reddit.com/r/webscraping/comments/1swfcsz/phonenative_alternative_to_login_scraping_using/,complaint,"[Verified] The thread described login scraping as fragile because of 2FA, modern bot detection, and session reuse complexity.","[Verified] Users care because public-page extraction misses the data they actually need from dashboards, portals, and account views.","[Verified] Reddit post published May 2, 2026.",high,[Inference] Clearpage should assume authenticated extraction needs stable session reuse and explicit session-health checks rather than one-off login automation.
domain_painpoint,authenticated_pages_and_session_reuse,github_issue,[Bug]: Persistent Context (userDataDir) Fails Cookie Read & Corrupts Profile,https://github.com/microsoft/playwright/issues/35466,complaint,[Verified] A Playwright user reported persistent browser context problems including cookie-read failure and corrupted profile behavior.,[Verified] Session reuse is hard if the underlying browser-state primitive behaves differently across modes or damages the profile.,[Verified] GitHub issue was active in 2026 and crawled last week; the issue page shows it remains a recent problem.,high,[Inference] Clearpage should avoid assuming browser profile persistence is a solved foundation for authenticated workflows.
domain_painpoint,pdf_and_office_document_extraction,github_issue,The flowchart in Word document containing Visio or the UML in Visio cannot be converted to MD file correctly,https://github.com/microsoft/markitdown/issues/1817,complaint,[Verified] MarkItDown users reported incorrect Markdown conversion for Word documents containing Visio or UML flowcharts.,"[Verified] Office extraction demand includes embedded diagrams and mixed-content documents, not just body text.","[Verified] GitHub issue opened April 22, 2026.",high,"[Inference] Clearpage should scope Office support by document subtype and embedded-content behavior, not just file extension."
domain_painpoint,pdf_and_office_document_extraction,github_issue,"[BUG] docling-tools models download easyocr only downloads English/Latin models, causing failures for non-English documents",https://github.com/docling-project/docling/issues/2866,complaint,[Verified] Docling users reported non-English OCR failure in offline mode because only English and Latin models were downloaded.,"[Verified] Multilingual document support affects actual extraction coverage, deployment packaging, and runtime cost.","[Verified] GitHub issue opened January 9, 2026.",high,[Inference] Clearpage should treat multilingual OCR coverage and artifact packaging as explicit product constraints rather than hidden defaults.
domain_painpoint,pdf_and_office_document_extraction,github_issue,Docling hangs on some pdfs,https://github.com/docling-project/docling/issues/2109,complaint,[Verified] Docling users reported certain PDFs hanging during conversion.,[Verified] A stalled document job is worse than a clean failure because it blocks batch throughput and obscures the true state of work.,"[Verified] GitHub issue opened August 20, 2025.",high,[Inference] Clearpage should enforce timeouts and explicit stuck-job reporting on document pipelines.
domain_painpoint,batch_jobs_retries_and_observability,github_issue,[Bug] No Data is Returned After Crawling (formats-JSON),https://github.com/firecrawl/firecrawl/issues/1309,complaint,[Verified] Firecrawl users reported jobs marked completed and successful while returning an empty data array.,[Verified] False-success states break automation trust because the control plane says success while the payload says failure.,"[Verified] GitHub issue opened March 7, 2025.",high,"[Inference] Clearpage should distinguish transport completion, render completion, and data success in batch status reporting."
domain_painpoint,batch_jobs_retries_and_observability,github_issue,The request queue scans all 450k (99.999% of which are done towards the end) requests for each iteration,https://github.com/apify/crawlee/issues/2406,complaint,[Verified] Crawlee users reported extreme queue inefficiency near job completion because the queue kept scanning almost all completed requests.,"[Verified] Users care because queue inefficiency drives runtime, infrastructure cost, and uncertainty on large recurring jobs.","[Verified] GitHub issue opened April 7, 2024.",high,"[Inference] If Clearpage adds recurring queues, it should expose queue efficiency and retry behavior instead of hiding them behind a generic progress state."
domain_painpoint,screenshot_cleanliness_and_visual_verification,github_issue,[Feat] Remove cookie banner/pop up from screenshots,https://github.com/mendableai/firecrawl/issues/647,feature_request,[Verified] Firecrawl users asked for screenshot cleanup because cookie banners and privacy popups block meaningful content.,[Verified] Visual verification is less useful if the screenshot captures overlays rather than the content users intended to inspect.,"[Verified] GitHub issue opened September 9, 2024.",medium,"[Inference] Clearpage can improve trust by treating screenshot cleanliness as part of extraction quality, not as a cosmetic extra."
domain_painpoint,token_cost_output_size_and_multilingual_overhead,github_issue,Extremely high token usage on s.jina.ai — spikes up to 1.9M tokens per single request,https://github.com/jina-ai/reader/issues/1241,complaint,[Verified] Jina Reader users reported token spikes up to 1.9 million tokens for a single request.,[Verified] Output-size unpredictability creates direct cost risk and makes agent loops harder to budget or bound.,"[Verified] GitHub issue opened April 9, 2026.",high,[Inference] Clearpage should expose output-size or token-risk indicators when extraction can balloon unexpectedly.
domain_painpoint,selector_capture_replayability_and_deterministic_handoff,github_issue,Bug: Initial actions not saved to history and incomplete serialization breaking replay functionality,https://github.com/browser-use/browser-use/issues/3044,complaint,[Verified] Browser Use users reported replay failure because initial actions were not stored and history serialization was incomplete.,[Verified] Users need automation artifacts that can be replayed and debugged deterministically after exploratory runs.,"[Verified] GitHub issue opened September 9, 2025.",high,"[Inference] If Clearpage captures selectors or actions, it should store enough state for full replay instead of just partial execution traces."
domain_painpoint,selector_capture_replayability_and_deterministic_handoff,github_issue,[Feature] Configurable selectors in codegen,https://github.com/microsoft/playwright/issues/9015,feature_request,[Verified] Playwright users requested configurable selector-building attributes because real teams use custom test IDs and locator conventions.,[Verified] Recorder output becomes brittle if it does not match the selector strategy actually used in production apps.,"[Verified] GitHub issue opened September 19, 2021 and still remains open as a feedback signal.",medium,"[Inference] Clearpage should assume deterministic handoff requires adaptable selector strategies, not one default locator heuristic."
comparison_article,firecrawl_vs_crawl4ai,public_blog,Crawl4AI vs. Firecrawl,https://blog.apify.com/crawl4ai-vs-firecrawl/,complaint,"The comparison frames Firecrawl as a managed path with built-in retries, logs, browser fleet, and captcha help, while Crawl4AI leaves token management, browser ops, and infrastructure to the user.","This is direct evidence that operational burden itself is part of product selection, not just price or extraction quality.",Published 3 months before 2026-05-16; opened from current live web search.,high,Clearpage should make operational burden visible as a product advantage if it keeps browser and batch workflows simple.
comparison_article,firecrawl_vs_crawl4ai,public_blog,Crawl4AI vs. Firecrawl,https://blog.apify.com/crawl4ai-vs-firecrawl/,feature_request,The comparison says Firecrawl uses plain-English extraction prompts while Crawl4AI rewards selector and heuristic tuning.,Users want either easy no-config extraction or explicit deep control; confusing middle ground creates friction.,Published 3 months before 2026-05-16.,medium,Clearpage should decide where it sits on no-config versus explicit-control surfaces and make that choice obvious.
comparison_article,firecrawl_vs_crawl4ai,public_blog,Firecrawl vs Crawl4AI: Which Web Crawler is Better for AI?,https://zackproser.com/blog/firecrawl-vs-crawl4ai,complaint,"The essay calls out Crawl4AI setup and scaling overhead: browser lifecycle, memory cost, queues, rate limiting, and anti-bot handling remain user responsibilities.",Teams frequently choose based on who owns the infrastructure burden after the first demo.,"Published February 28, 2026.",high,Clearpage can win if it removes operational ownership from the user without hiding extraction truth.
comparison_article,firecrawl_vs_crawl4ai,public_blog,Firecrawl vs Crawl4AI: Which Web Crawler is Better for AI?,https://zackproser.com/blog/firecrawl-vs-crawl4ai,signal,"The same essay frames Firecrawl as attractive when scraping is a means to an end, not the core product.",Users building AI apps often do not want scraping infrastructure to become their main engineering problem.,"Published February 28, 2026.",medium,"Clearpage should position itself around the user job completed, not around scraping complexity for its own sake."
comparison_article,firecrawl_crawl4ai_jina,public_blog,Firecrawl vs Crawl4AI vs Jina Reader: Best AI Web Scraping Tool in 2026,https://toolhalla.ai/blog/firecrawl-vs-crawl4ai-vs-jina-reader-2026,signal,"The comparison organizes real-world tasks around single-page RAG, full-docs crawling, structured product extraction, and real-time agent data.","This confirms that users judge tools by practical workload categories, not by abstract feature lists.","Published March 21, 2026.",medium,Clearpage should map its messaging and roadmap to concrete workloads rather than generic extraction claims.
comparison_article,crawl4ai_vs_firecrawl,public_directory,Crawl4AI vs Firecrawl,https://deepyard.dev/compare/crawl4ai-vs-firecrawl,signal,The live comparison highlights a gap in issue volume and contributor scale while also splitting the brands into 'local crawler' versus 'API LLM-data' identities.,Public comparisons increasingly compress products into operational identity: local control versus managed API.,"Last updated May 13, 2026.",medium,"Clearpage should be explicit about whether it is a workflow product, a managed API, a local tool, or some hybrid."
comparison_article,browser_agent_tasks,reddit_thread,Tested 6 browser use agents for real-world tasks — here's an honest breakdown + looking for recommendations,https://www.reddit.com/r/AI_Agents/comments/1slc8rj/tested_6_browser_use_agents_for_realworld_tasks/,complaint,"A commenter says login plus three or more steps breaks every screenshot-driven approach, and that large accessibility trees overflow smaller model context windows.",This shows that browser-agent pain is structural: input representation and step depth matter more than vendor branding.,Published last month; opened from live web search.,high,"Clearpage should avoid assuming screenshot-driven browser automation scales cleanly to long, authenticated workflows."
comparison_article,browser_scraping_agents,reddit_thread,Is browser-based web scraping the next major unlock for AI agents?,https://www.reddit.com/r/AI_Agents/comments/1on3ft6/is_browserbased_web_scraping_the_next_major/,complaint,"A commenter says anti-scraping measures and IP bans make quality decay silently unless teams have narrow scope, monitoring, and fallback handling.",Silent drift is one of the most dangerous failure modes in recurring extraction workflows.,Published 6 months before 2026-05-16; opened from live web search.,high,"Clearpage should pair extraction with validation, monitoring, and explicit fallback behavior if it expands recurring workflows."
comparison_article,document_intelligence_vs_scraping,reddit_thread,What is your opinion on AI agents for web scraping?,https://www.reddit.com/r/thewebscrapingclub/comments/1tct7s4/what_is_your_opinion_on_ai_agents_for_web_scraping/,signal,"A commenter says the harder problem is often what happens after scraping: turning PDFs, reports, and messy exports into structured, queryable data.","This separates live-page scraping pain from downstream document-intelligence pain, both of which matter to users.",Published yesterday; opened from live web search.,high,"Clearpage should keep document-conversion and cleanup as a first-class value path, not a side effect of URL extraction."
document_intelligence,trafilatura,github_readme,trafilatura markdown_fidelity,https://github.com/adbar/trafilatura,signal,"[Verified] Trafilatura advertises extraction of paragraphs, titles, lists, quotes, code, links, images, and tables, plus optional language detection.",[Inference] User demand exists when a tool promises structural fidelity because users expect markdown output to preserve more than plain text.,captured_live_2026-05-16,medium,[Inference] User demand exists when a tool promises structural fidelity because users expect markdown output to preserve more than plain text.
document_intelligence,trafilatura,github_issue,trafilatura headings_lists_images,https://github.com/adbar/trafilatura/issues/63,complaint,"[Verified] A user report shows headings, bullets, images, and table structure collapsing or flattening in rich-content extraction output.","[Inference] If headings or bullets flatten, Clearpage output can look complete while losing hierarchy and readability.",captured_live_2026-05-16,high,"[Inference] If headings or bullets flatten, Clearpage output can look complete while losing hierarchy and readability."
document_intelligence,trafilatura,github_issue,trafilatura headings,https://github.com/adbar/trafilatura/issues/777,complaint,[Verified] The issue tracker includes an open report that structured heading tags such as h2 and h3 fail to extract correctly.,"[Inference] Heading damage breaks markdown navigation, chunking quality, and section-aware downstream prompts.",captured_live_2026-05-16,high,"[Inference] Heading damage breaks markdown navigation, chunking quality, and section-aware downstream prompts."
document_intelligence,trafilatura,github_issue,trafilatura lists_links,https://github.com/adbar/trafilatura/issues/792,complaint,[Verified] The issue tracker includes an open report that markdown conversion removes elements with anchors inside lists.,[Inference] Link-heavy docs and docs-site nav lists can lose important items even when extraction otherwise succeeds.,captured_live_2026-05-16,high,[Inference] Link-heavy docs and docs-site nav lists can lose important items even when extraction otherwise succeeds.
document_intelligence,trafilatura,github_issue,trafilatura tables,https://github.com/adbar/trafilatura/issues/778,complaint,[Verified] The issue tracker includes an open report that table tags are incorrect in HTML-formatted output.,[Inference] Bad intermediate table structure makes later markdown or JSON conversion less trustworthy.,captured_live_2026-05-16,high,[Inference] Bad intermediate table structure makes later markdown or JSON conversion less trustworthy.
document_intelligence,mozilla-readability,github_readme,mozilla-readability structured_output,https://github.com/mozilla/readability,complaint,"[Verified] Readability returns processed article HTML and plain text, and its `isProbablyReaderable()` helper is documented as likely to produce both false positives and false negatives.",[Inference] Clearpage would still need a separate markdown or structured-output layer and should not treat readerability checks as authoritative.,captured_live_2026-05-16,high,[Inference] Clearpage would still need a separate markdown or structured-output layer and should not treat readerability checks as authoritative.
document_intelligence,mozilla-readability,github_issue,mozilla-readability site_specific_failures,https://github.com/mozilla/readability/issues/436,complaint,[Verified] An issue reports that mobile Wikipedia pages fail to parse with readability.js.,"[Inference] Even mature main-content extractors still fail on important public content surfaces, so fallback paths matter.",captured_live_2026-05-16,high,"[Inference] Even mature main-content extractors still fail on important public content surfaces, so fallback paths matter."
document_intelligence,mozilla-readability,github_issue,mozilla-readability complex_layouts,https://github.com/mozilla/readability/issues/977,complaint,[Verified] The issue tracker includes an open report that GitHub issue pages are not processed properly by Readability.,"[Inference] Discussion-style pages, docs threads, and hybrid content layouts remain fragile for article-style extractors.",captured_live_2026-05-16,high,"[Inference] Discussion-style pages, docs threads, and hybrid content layouts remain fragile for article-style extractors."
document_intelligence,mozilla-readability,github_pr,mozilla-readability headings,https://github.com/mozilla/readability/pulls,complaint,"[Verified] The current pull-request list includes work to preserve Wikipedia h2 headings, which signals unresolved heading fidelity gaps.","[Inference] Basic heading preservation is still active maintenance work, so markdown hierarchy cannot be assumed stable.",captured_live_2026-05-16,high,"[Inference] Basic heading preservation is still active maintenance work, so markdown hierarchy cannot be assumed stable."
