scope,subject,source_type,source_title,source_url,signal_type,signal_summary,why_users_care,recency_note,severity,clearpage_implication
browser_agent,webclaw,docs,webclaw local-first-cloud-fallback,https://webclaw.io/docs/mcp,signal,"Webclaw's MCP docs say the local-first server auto-falls back to the cloud for Cloudflare, DataDome, AWS WAF, and JS-heavy SPAs when a key is present.",Protected pages push users into a more expensive fallback tier even in local-first products.,captured_live_2026-05-16,medium,Protected pages push users into a more expensive fallback tier even in local-first products.
browser_agent,webclaw,docs,webclaw self-host-limits,https://webclaw.io/docs/self-hosting,complaint,"Webclaw's self-hosting docs explicitly exclude Cloudflare/DataDome/AWS WAF bypass, JS rendering, proxy rotation, and session-cookie warming.",Users cannot assume the self-hosted path will handle the hardest dynamic or protected sites.,captured_live_2026-05-16,high,Users cannot assume the self-hosted path will handle the hardest dynamic or protected sites.
browser_agent,webclaw,reddit,webclaw trust-boundary,https://www.reddit.com/r/ClaudeAI/comments/1s9syoj/webclaw_hit_almost_400_github_stars_in_8_days/,complaint,A detailed Reddit critique says the local-versus-cloud boundary feels unclear and harder cases can still produce failures or messy output.,Trust drops when the escalation boundary is vague and output quality varies by target.,captured_live_2026-05-16,high,Trust drops when the escalation boundary is vague and output quality varies by target.
browser_agent,webclaw,reddit,webclaw browser-overuse,https://www.reddit.com/r/scrapingtheweb/comments/1sqsoos/one_month_of_webclaw_the_oss_web_scraping_api_i/,complaint,"A builder report says Firecrawl felt slow and Crawl4AI launched a browser for pages that did not need one, prompting a local-first MCP route.",Users want cheap static extraction first and browser escalation only when necessary.,captured_live_2026-05-16,high,Users want cheap static extraction first and browser escalation only when necessary.
browser_agent,adjacent,hacker_news,adjacent determinism-vs-agent-loops,https://news.ycombinator.com/item?id=44007065,complaint,"Workflow Use's HN launch says pure LLM browser agents were slow, expensive, and unpredictable, so the team moved repeated work into recorded deterministic scripts.","Users want agents mainly for discovery and fallback, not for every repetitive browser action.",captured_live_2026-05-16,high,"Users want agents mainly for discovery and fallback, not for every repetitive browser action."
browser_agent,adjacent,reddit,adjacent anti-bot-over-parsing,https://www.reddit.com/r/sideprojects/comments/1tc5yu3/we_made_1m_from_scraping_since_2023_antibot_not/,complaint,A scraping founder thread argues that production pain starts at anti-bot defenses rather than parsing and says inline CAPTCHA solving reduced fake-success output.,"Products need honest blocked-state handling, not just better markdown cleanup.",captured_live_2026-05-16,high,"Products need honest blocked-state handling, not just better markdown cleanup."
browser_agent,adjacent,reddit,adjacent static-vs-browser-routing,https://www.reddit.com/r/mcp/comments/1ssuwt7/webcrawlmcp_a_localfirst_mcp_server_for_scraping/,complaint,A local-first MCP thread says headless browsers are overkill for most static docs work and also notes that 403s are worsening.,Routing the easy pages away from browsers lowers cost and keeps failures easier to reason about.,captured_live_2026-05-16,high,Routing the easy pages away from browsers lowers cost and keeps failures easier to reason about.
onboarding_pricing,firecrawl,product_hunt,firecrawl first_success,https://www.producthunt.com/products/extract-by-firecrawl/launches/firecrawl-v2-5?comment=4980494,praise,"[Verified] Product Hunt presents Firecrawl as a one-call way to turn a URL into markdown or structured data, which explains its strong quick-trial appeal.",[Verified] New users can see value without learning a complex crawler model first.,captured_live_2026-05-16,medium,[Verified] New users can see value without learning a complex crawler model first.
onboarding_pricing,firecrawl,github_issue,firecrawl onboarding_friction,https://github.com/firecrawl/firecrawl/issues/1294,complaint,[Verified] A self-hosted user reported that `/scrape` worked but `/extract` failed under the Docker-based local setup.,[Verified] A new user can get a partial win and still fail on the higher-value extraction path in the first session.,captured_live_2026-05-16,high,[Verified] A new user can get a partial win and still fail on the higher-value extraction path in the first session.
onboarding_pricing,firecrawl,github_issue,firecrawl honeymoon_gap,https://github.com/firecrawl/firecrawl/issues/1309,complaint,[Verified] A user reported crawl jobs returning `completed` with an empty `data` array and no visible error.,[Verified] Early trust drops fast when success status and actual output do not match.,captured_live_2026-05-16,high,[Verified] Early trust drops fast when success status and actual output do not match.
onboarding_pricing,firecrawl,github_issue,firecrawl honeymoon_gap,https://github.com/firecrawl/firecrawl/issues/2350,complaint,[Verified] A self-hosted user reported Firecrawl becoming unresponsive in an anti-bot fallback loop with repeated waterfall logs.,"[Verified] The product can feel production-ready in a demo, then become brittle on protected pages.",captured_live_2026-05-16,high,"[Verified] The product can feel production-ready in a demo, then become brittle on protected pages."
onboarding_pricing,firecrawl,reddit,firecrawl pricing_credit_frustration,https://www.reddit.com/r/n8n/comments/1q4eccq/any_payasyougo_scrapers_that_dont_expire_credits/,complaint,"[Verified] An `r/n8n` user said Firecrawl works, but bursty usage feels expensive because unused monthly credits vanish and the API key effectively feels like a retainer.",[Verified] Buyers with uneven workloads hesitate to commit when idle months still burn value.,captured_live_2026-05-16,high,[Verified] Buyers with uneven workloads hesitate to commit when idle months still burn value.
onboarding_pricing,jina-reader,hacker_news,jina-reader first_success,https://news.ycombinator.com/item?id=41429728,praise,[Verified] A Hacker News user praised Jina Reader for the simple `r.jina.ai/<url>` flow that returns markdown from any page.,[Verified] The first-success path is extremely easy to explain and test.,captured_live_2026-05-16,medium,[Verified] The first-success path is extremely easy to explain and test.
onboarding_pricing,jina-reader,github_issue,jina-reader onboarding_friction,https://github.com/jina-ai/reader/issues/1224,complaint,"[Verified] A GitHub user said the docs are lacking, the interactive builder is buggy, and the response shape is hard to understand.",[Verified] Integration confidence drops before the user even reaches production volume.,captured_live_2026-05-16,high,[Verified] Integration confidence drops before the user even reaches production volume.
onboarding_pricing,jina-reader,github_issue,jina-reader pricing_credit_frustration,https://github.com/jina-ai/reader/issues/1241,complaint,[Verified] A production user reported single `s.jina.ai` requests spiking to about 1.9M tokens and averaging far above the expected floor.,[Verified] Token-cost unpredictability weakens spending confidence immediately.,captured_live_2026-05-16,high,[Verified] Token-cost unpredictability weakens spending confidence immediately.
onboarding_pricing,jina-reader,github_issue,jina-reader honeymoon_gap,https://github.com/jina-ai/reader/issues/1148,complaint,[Verified] A user said heavy JavaScript comparison pages returned gibberish through the Jina Reader API.,[Verified] The fast first win on simple pages does not carry cleanly to richer interactive pages.,captured_live_2026-05-16,high,[Verified] The fast first win on simple pages does not carry cleanly to richer interactive pages.
onboarding_pricing,crawl4ai,docs,crawl4ai first_success,https://docs.crawl4ai.com/core/self-hosting/,praise,[Verified] Crawl4AI's self-hosting docs expose a local playground and monitor dashboard for interactive testing and visibility.,[Verified] Technical users get a guided first-run surface instead of a blind container launch.,captured_live_2026-05-16,medium,[Verified] Technical users get a guided first-run surface instead of a blind container launch.
onboarding_pricing,crawl4ai,reddit,crawl4ai onboarding_friction,https://www.reddit.com/r/AgentsOfAI/comments/1t3pe4e/firecrawl_vs_crawl4ai_i_tried_both_and_heres_what/,complaint,"[Verified] A Reddit user said Docker setup took about an hour, needs meaningful RAM, and turns into infrastructure debugging when things break.","[Verified] The local-first value story is strong, but the first session is still operationally heavy for many users.",captured_live_2026-05-16,high,"[Verified] The local-first value story is strong, but the first session is still operationally heavy for many users."
onboarding_pricing,crawl4ai,github_issue,crawl4ai honeymoon_gap,https://github.com/unclecode/crawl4ai/issues/1963,complaint,[Verified] A GitHub issue says MCP scrape tools return incomplete results on JS-heavy pages because they lack the wait controls available in REST and CLI.,[Verified] Users hit a gap between the tutorial promise and real dynamic-page behavior once they move to agent workflows.,captured_live_2026-05-16,high,[Verified] Users hit a gap between the tutorial promise and real dynamic-page behavior once they move to agent workflows.
onboarding_pricing,browser-use,product_hunt_review,browser-use first_success,https://www.producthunt.com/products/browser-use,praise,[Verified] Product Hunt reviews say Browser Use made browser automation simpler than older Selenium or LangChain-heavy setups.,[Verified] Users can feel progress quickly without building custom browser tooling first.,captured_live_2026-05-16,medium,[Verified] Users can feel progress quickly without building custom browser tooling first.
onboarding_pricing,browser-use,github_issue,browser-use onboarding_friction,https://github.com/browser-use/browser-use/issues/4824,complaint,[Verified] A GitHub issue says exact dependency pinning makes Browser Use hard to integrate into larger Python projects.,[Verified] Teams can fail before real usage because the package collides with the rest of their stack.,captured_live_2026-05-16,high,[Verified] Teams can fail before real usage because the package collides with the rest of their stack.
onboarding_pricing,browser-use,reddit,browser-use honeymoon_gap,https://www.reddit.com/r/AI_Agents/comments/1hzt9tt/browseruse_sucks/,complaint,"[Verified] Public Reddit comments report installation breaking on first run, loops, `about:blank` stalls, and very slow execution on basic tasks.",[Verified] The early wow factor disappears when simple flows are not dependable.,captured_live_2026-05-16,high,[Verified] The early wow factor disappears when simple flows are not dependable.
onboarding_pricing,browser-use,reddit,browser-use pricing_credit_frustration,https://www.reddit.com/r/AI_Agents/comments/1hzt9tt/browseruse_sucks/,complaint,"[Verified] The same Reddit thread includes public complaints from users who said they bought a subscription, did not get working value, and wanted refunds.",[Verified] Spending confidence drops sharply when a paid plan feels broken before a user gets reliable outcomes.,captured_live_2026-05-16,high,[Verified] Spending confidence drops sharply when a paid plan feels broken before a user gets reliable outcomes.
onboarding_pricing,webclaw,docs,webclaw first_success,https://webclaw.io/blog/migrating-from-firecrawl-compatible-api,praise,"[Verified] Webclaw's migration guide says the first test can be as simple as keeping the same request body, changing the base URL, and comparing the response.",[Verified] That lowers switching cost and makes first evaluation very fast.,captured_live_2026-05-16,medium,[Verified] That lowers switching cost and makes first evaluation very fast.
onboarding_pricing,webclaw,reddit,webclaw pricing_confidence,https://www.reddit.com/r/scrapingtheweb/comments/1sqsoos/one_month_of_webclaw_the_oss_web_scraping_api_i/,praise,"[Verified] A Reddit post frames Webclaw as fast, scriptable, local-first, and usable without the hosted API except for the hardest anti-bot cases.",[Verified] Users get a clearer path to avoid recurring hosted spend for normal workloads.,captured_live_2026-05-16,medium,[Verified] Users get a clearer path to avoid recurring hosted spend for normal workloads.
onboarding_pricing,webclaw,github_discussion,webclaw honeymoon_gap,https://github.com/0xMassi/webclaw/discussions/13,feature_request,[Verified] Public GitHub discussion titles show users quickly asking for hydration-state extraction from SPA pages.,"[Verified] After the first scrape works, users immediately want deeper page-state access that plain extraction does not provide.",captured_live_2026-05-16,medium,"[Verified] After the first scrape works, users immediately want deeper page-state access that plain extraction does not provide."
onboarding_pricing,webpeel,docs,webpeel first_success,https://webpeel.dev/,praise,"[Verified] WebPeel promises install in one command, no dependency setup, and live extraction in minutes.",[Verified] The onboarding path is intentionally optimized for immediate trial success.,captured_live_2026-05-16,medium,[Verified] The onboarding path is intentionally optimized for immediate trial success.
onboarding_pricing,webpeel,docs,webpeel pricing_confidence,https://webpeel.dev/,praise,"[Verified] WebPeel advertises a free tier with no credit card and full feature access, plus self-hosting for unlimited local usage.",[Verified] Buyers can test real capability before committing money or billing details.,captured_live_2026-05-16,medium,[Verified] Buyers can test real capability before committing money or billing details.
onboarding_pricing,webpeel,github_issues_index,webpeel source_gap,https://github.com/webpeel/webpeel/issues,source_gap,[Verified] WebPeel's public GitHub issues page showed no open issues during this pass.,[Verified] The thin public backlog makes honeymoon-risk hard to measure from public evidence alone.,captured_live_2026-05-16,low,[Verified] The thin public backlog makes honeymoon-risk hard to measure from public evidence alone.
onboarding_pricing,crw,docs,crw pricing_confidence,https://fastcrw.com/,praise,"[Verified] CRW's public site emphasizes zero configuration, 500 free credits, no credit card, predictable paid tiers, and free self-hosting.",[Verified] Users can model spend early and avoid signup friction.,captured_live_2026-05-16,medium,[Verified] Users can model spend early and avoid signup friction.
onboarding_pricing,crw,reddit,crw first_success,https://www.reddit.com/r/openclaw/comments/1s8ztah/best_way_to_do_web_scraping_search_automation_in/,praise,"[Verified] In `r/openclaw`, a commenter recommended fastCRW specifically as a fast, lightweight, open-source scraper.",[Verified] Community shorthand around speed and lightness helps first-time evaluators choose it quickly.,captured_live_2026-05-16,medium,[Verified] Community shorthand around speed and lightness helps first-time evaluators choose it quickly.
onboarding_pricing,crw,github_issues_index,crw source_gap,https://github.com/us/crw/issues,source_gap,[Verified] CRW's public GitHub issues page showed zero open issues in this pass.,[Verified] The limited public complaint surface keeps long-run confidence provisional.,captured_live_2026-05-16,low,[Verified] The limited public complaint surface keeps long-run confidence provisional.
onboarding_pricing,scrapegraphai,product_hunt,scrapegraphai first_success,https://www.producthunt.com/products/scrapegraphai,praise,[Verified] Product Hunt presents ScrapeGraphAI as a simple prompt-based way to turn websites into structured JSON.,[Verified] The value proposition is easy to grasp on first contact.,captured_live_2026-05-16,medium,[Verified] The value proposition is easy to grasp on first contact.
onboarding_pricing,scrapegraphai,github_discussion,scrapegraphai onboarding_friction,https://github.com/orgs/ScrapeGraphAI/discussions/997,complaint,[Verified] ScrapeGraphAI maintainers tell users that authenticated sites require a separate Playwright login flow and a saved session state file.,[Verified] Real-world authenticated scraping is not a one-step experience even when the product story sounds prompt-first.,captured_live_2026-05-16,high,[Verified] Real-world authenticated scraping is not a one-step experience even when the product story sounds prompt-first.
onboarding_pricing,scrapegraphai,github_issue,scrapegraphai honeymoon_gap,https://github.com/ScrapeGraphAI/Scrapegraph-ai/issues/1045,complaint,[Verified] A GitHub issue says verbose mode is not useful enough to explain poor extraction or malformed JSON even on simple pages.,[Verified] Users lose confidence when the tool fails but cannot explain why.,captured_live_2026-05-16,high,[Verified] Users lose confidence when the tool fails but cannot explain why.
onboarding_pricing,apify/crawlee,docs,apify/crawlee first_success,https://docs.apify.com/sdk/js/docs/1.3/guides/getting-started,praise,"[Verified] Apify's getting-started docs walk users to a first crawler and explicitly say ""And we're done!"" once the title prints.",[Verified] The tutorial path gives a clear first-success checkpoint.,captured_live_2026-05-16,medium,[Verified] The tutorial path gives a clear first-success checkpoint.
onboarding_pricing,apify/crawlee,github_discussion,apify/crawlee onboarding_friction,https://github.com/apify/crawlee-python/discussions/575,complaint,"[Verified] A Crawlee Python discussion shows a user unable to tell if proxies, retries, sessions, or user agents were working while Reddit kept returning 403s.",[Verified] A user can leave the setup stage still unsure whether the crawler is behaving correctly.,captured_live_2026-05-16,high,[Verified] A user can leave the setup stage still unsure whether the crawler is behaving correctly.
onboarding_pricing,apify/crawlee,github_discussion,apify/crawlee honeymoon_gap,https://github.com/apify/crawlee/discussions/2175,complaint,"[Verified] A Crawlee discussion shows errors from `failedRequestHandler` not propagating to the main flow, forcing custom promise plumbing.","[Verified] Once users move past tutorials into single-URL production flows, error handling becomes harder than expected.",captured_live_2026-05-16,high,"[Verified] Once users move past tutorials into single-URL production flows, error handling becomes harder than expected."
onboarding_pricing,apify/crawlee,reddit,apify/crawlee pricing_credit_frustration,https://www.reddit.com/r/apify/comments/1rpswcb/apify_your_pricing_changes_for_builders_is_unfair/,complaint,[Verified] Public `r/apify` posts describe builder-economics frustration and pricing or store-comparison friction even while praising the technical platform.,[Verified] Users can like the product technically but still hesitate to build a business on its current pricing surface.,captured_live_2026-05-16,high,[Verified] Users can like the product technically but still hesitate to build a business on its current pricing surface.
thin_signal_product,webpeel,official_site,webpeel agent-first extraction breadth,https://webpeel.dev/,signal,"[Verified] WebPeel presents itself as a web extraction API for AI agents with fetch, search, crawl, structured JSON, screenshots, browser actions, monitoring, and Firecrawl-compatible endpoints.",[Inference] Users evaluating Clearpage will see WebPeel as a broad low-cost alternative even before community proof exists.,captured_live_2026-05-16,medium,[Inference] Users evaluating Clearpage will see WebPeel as a broad low-cost alternative even before community proof exists.
thin_signal_product,webpeel,official_site,webpeel low-friction entry pricing,https://webpeel.dev/,signal,"[Verified] The official site shows Free at 500 fetches per week, Pro at $9 per month, and Max at $29 per month with no credit card required for free usage.",[Inference] This makes WebPeel a pricing and packaging threat for lightweight agent workflows.,captured_live_2026-05-16,medium,[Inference] This makes WebPeel a pricing and packaging threat for lightweight agent workflows.
thin_signal_product,webpeel,github_repo,webpeel public backlog gap,https://github.com/webpeel/webpeel,source_gap,"[Verified] The public GitHub repo showed 8 stars, 0 public issues, and 14 pull requests during this pass.",[Inference] Thin public issue volume makes reliability and support depth hard to judge from outside.,captured_live_2026-05-16,low,[Inference] Thin public issue volume makes reliability and support depth hard to judge from outside.
thin_signal_product,webpeel,official_blog,webpeel self-authored benchmarking,https://webpeel.dev/blog,signal,"[Verified] The official blog is active and centers comparisons, benchmarks, and practical guides rather than visible third-party reviews.","[Inference] Prospects get a polished narrative, but Clearpage should discount it as mostly vendor-authored proof.",captured_live_2026-05-16,medium,"[Inference] Prospects get a polished narrative, but Clearpage should discount it as mostly vendor-authored proof."
thin_signal_product,webpeel,official_package,webpeel package-level positioning,https://pypi.org/project/webpeel/,signal,[Verified] The PyPI package description explicitly frames WebPeel as a Firecrawl alternative and repeats product comparisons inside the official package page.,"[Inference] Even package metadata is being used as a conversion surface, which signals deliberate positioning but not broad external validation.",captured_live_2026-05-16,medium,"[Inference] Even package metadata is being used as a conversion surface, which signals deliberate positioning but not broad external validation."
thin_signal_product,webpeel,official_changelog,webpeel shipping velocity without community depth,https://webpeel.dev/changelog,signal,"[Verified] The changelog shows frequent March 2026 releases, extractor additions, MCP consolidation, and pricing accuracy fixes.","[Inference] The product is actively shipped, but active shipping does not by itself prove broad user adoption.",captured_live_2026-05-16,medium,"[Inference] The product is actively shipped, but active shipping does not by itself prove broad user adoption."
thin_signal_product,crw,official_site,crw ops-simple Firecrawl alternative,https://fastcrw.com/,signal,"[Verified] CRW is positioned as a Rust-based Firecrawl-compatible scraper with scrape, search, browse, crawl, and map for AI agents.",[Inference] This makes CRW relevant to Clearpage as a simpler infrastructure and compatibility alternative.,captured_live_2026-05-16,medium,[Inference] This makes CRW relevant to Clearpage as a simpler infrastructure and compatibility alternative.
thin_signal_product,crw,official_pricing,crw real commercial surface,https://fastcrw.com/pricing,signal,"[Verified] The pricing page shows Free at 500 credits, Hobby at $19 per month monthly or $13 per month yearly launch price, then Standard, Growth, and Scale tiers.","[Inference] Users can treat CRW as a real buy decision, not just an OSS experiment.",captured_live_2026-05-16,medium,"[Inference] Users can treat CRW as a real buy decision, not just an OSS experiment."
thin_signal_product,crw,official_docs,crw self-host plus cloud onboarding,https://docs.fastcrw.com/installation/,signal,"[Verified] The installation docs offer immediate cloud use plus one-line install, crates.io packages, source builds, Docker, and MCP binaries.",[Inference] CRW reduces onboarding friction for technical teams that want cloud first or self-hosted later.,captured_live_2026-05-16,medium,[Inference] CRW reduces onboarding friction for technical teams that want cloud first or self-hosted later.
thin_signal_product,crw,github_repo,crw quiet public backlog,https://github.com/us/crw,source_gap,"[Verified] The public GitHub repo showed 88 stars, 0 public issues, and 0 public pull requests during this pass.","[Inference] The product may be early or privately supported, but the visible public demand surface is thin.",captured_live_2026-05-16,low,"[Inference] The product may be early or privately supported, but the visible public demand surface is thin."
thin_signal_product,crw,official_blog,crw vendor-authored benchmarks,https://fastcrw.com/blog/firecrawl-vs-crawl4ai-vs-crw,signal,"[Verified] The official blog publishes benchmark and alternative posts that compare CRW directly against Firecrawl, Tavily, Exa, and Crawl4AI.","[Inference] Clearpage can mine messaging ideas here, but not treat the comparisons as independent validation.",captured_live_2026-05-16,medium,"[Inference] Clearpage can mine messaging ideas here, but not treat the comparisons as independent validation."
thin_signal_product,crw,public_gap,crw missing public discussion layer,https://fastcrw.com/,source_gap,"[Verified] I did not find a clear Reddit, Hacker News, or Product Hunt discussion surface for CRW during this pass.",[Inference] Public adoption depth and failure patterns remain uncertain despite the polished official surface.,captured_live_2026-05-16,low,[Inference] Public adoption depth and failure patterns remain uncertain despite the polished official surface.
thin_signal_product,webclaw,official_site,webclaw anti-bot and agent-native messaging,https://webclaw.io/,signal,"[Verified] webclaw positions itself as a Rust-based extraction engine for LLMs with Firecrawl compatibility, MCP tooling, and TLS-level anti-bot handling.",[Inference] This overlaps closely with Clearpage's adjacent user job around cleaner ingestion from hostile or dynamic sites.,captured_live_2026-05-16,medium,[Inference] This overlaps closely with Clearpage's adjacent user job around cleaner ingestion from hostile or dynamic sites.
